artistName,artistID,artistPop,artistGenre
Taylor Swift,06HL4z0CvFAxyc27GXpf02,100.0,pop
Bad Bunny,4q3ewBCX7sLwd24euuV69X,99.0,"reggaeton, trap latino, urbano latino"
The Weeknd,1Xyo4u8uXC1ZmMpatF05PJ,98.0,"canadian contemporary r&b, canadian pop, pop"
Drake,3TVXtAsR1Inumwj472S9r4,97.0,"canadian hip hop, canadian pop, hip hop, rap, toronto rap"
Morgan Wallen,4oUHIQIBe0LHzYfvXNW4QM,94.0,contemporary country
MØ,4oUHIQIBe0LHzYfvXNW4QM,94.0,contemporary country
21 Savage,1URnnhqYAYcrqrcwql10ft,93.0,"atl hip hop, rap"
Eminem,7dGJo4pcD2V6oG8kP0tJRR,93.0,"detroit hip hop, hip hop, rap"
Rihanna,5pKCCKE2ajJHZ9KAiaK11H,93.0,"barbadian pop, pop, urban contemporary"
Miley Cyrus,5YGY8feqx7naU7z4HrwZM6,93.0,pop
Justin Bieber,1uNFoZAHBGtllmzznpCI3s,92.0,"canadian pop, pop"
Kanye West,5K4W6rqBFWDnAN6FQUkS6x,92.0,"chicago rap, rap"
BTS,3Nrfpe0tUJi4K4DXYWgMUX,92.0,"k-pop, k-pop boy group"
Ed Sheeran,6eUKZXaKkcviH0Ku9w2n3V,92.0,"pop, uk pop"
Future,1RyvyyTE3xzB2ZywiAwp0i,92.0,"atl hip hop, rap, southern hip hop, trap"
Travis Scott,0Y5tJX1MQlPlqiwlOH1tJY,91.0,"rap, slap house"
Lana Del Rey,00FQb4jTyendYWaN8pK0wa,91.0,"art pop, pop"
Metro Boomin,0iEtIxbK0KxaSlF7G42ZOp,91.0,rap
Kendrick Lamar,2YZyLoL8N0Wb9xBt1NhZWg,91.0,"conscious hip hop, hip hop, rap, west coast rap"
Harry Styles,6KImCVD70vtIoJWnq6nGn3,91.0,pop
Ozuna,1i8SpTcr7yvPOmcqrbnVXY,90.0,"puerto rican pop, reggaeton, trap latino, urbano latino"
Lil Baby,5f7VJjfbwm532GiveGC0ZK,90.0,"atl hip hop, atl trap, rap, trap"
Billie Eilish,6qqNVTkY8uBg9cP3Jd7DAH,90.0,"art pop, electropop, pop"
Coldplay,4gzpq5DPGxSnKTe4SA8HAU,90.0,"permanent wave, pop"
Imagine Dragons,53XhwfbYqKCa1cC15pYq2q,90.0,"modern rock, rock"
David Guetta,1Cs0zKBU1kc0i8ypK3B9ai,90.0,"big room, dance pop, edm, pop, pop dance"
Bruno Mars,0du5cEVh5yTK9QJze8zA0C,90.0,"dance pop, pop"
J. Cole,6l3HvQ5sa6mXTsMTB19rO5,89.0,"conscious hip hop, hip hop, north carolina hip hop, rap"
Lil Uzi Vert,4O15NlyKLIASxsJ0PrXPfz,89.0,"melodic rap, philly rap, rap, trap"
Sam Smith,2wY79sveU1sp5g7SokKOiI,89.0,"pop, uk pop"
Daddy Yankee,4VMYDCV2IEDYJArk749S6m,89.0,"latin hip hop, reggaeton, urbano latino"
Post Malone,246dkjvS1zLTtiykXe5h60,89.0,"dfw rap, melodic rap, rap"
Arctic Moon,7Ln80lUS6He07XvHI8qqHH,88.0,"garage rock, modern rock, permanent wave, rock, sheffield indie"
Beyonce,6vWDO969PvNqNYHIOW5v0m,88.0,"dance pop, pop, r&b"
Arctic Monkeys,7Ln80lUS6He07XvHI8qqHH,88.0,"garage rock, modern rock, permanent wave, rock, sheffield indie"
Nicki Minaj,0hCNtLu0JehylgoiP8L4Gh,88.0,"dance pop, hip pop, pop, queens hip hop, rap"
J Balvin,1vyhD5VmyZ7KMfW5gqLgo5,88.0,"reggaeton, reggaeton colombiano, urbano latino"
Lady Gaga,1HY2Jd0NmPuamShAr6KMms,88.0,"art pop, dance pop, pop"
Doja Cat,5cj0lLjcoR7YOSnhnX0Po5,88.0,"dance pop, pop"
Khalid,6LuN9FCkKOj5PcnpouEgny,87.0,"pop, pop r&b"
Blackpink,41MozSoPIsD1dJM0CLPjZF,87.0,"k-pop, k-pop girl group"
Calvin Harris,7CajNmpbOovFoOoasH2HaY,87.0,"dance pop, edm, electro house, house, pop, progressive house, uk dance"
Maroon 5,04gDigrS5kc9YWfZHwBETP,87.0,pop
Adele,4dpARuHxo51G3z768sgnrY,87.0,"british soul, pop, pop soul, uk pop"
Linkin Park,6XyY86QOPPrYVGvF9ch6wz,87.0,"alternative metal, nu metal, post-grunge, rap metal"
Lil Wayne,55Aa2cqylxrFIXC767Z865,87.0,"hip hop, new orleans rap, pop rap, rap, trap"
Tiesto,2o5jDhtHVPhrJdv3cEQ99Z,86.0,"big room, brostep, dutch edm, edm, house, pop, pop dance, slap house, trance"
"Tyler, The Creator",4V8LLVI7PbaPR0K2TGSxFF,86.0,"hip hop, rap"
Kali Uchis,1U1el3k54VvEUzo3ybLPlM,86.0,"colombian pop, pop"
Maluma,1r4hJ1h58CWwUQe3MxPuau,86.0,"reggaeton, reggaeton colombiano, urbano latino"
Jay-Z,3nFkdlSjzX9mRTtwJOzDYB,86.0,"east coast hip hop, hip hop, rap"
Rosalia,7ltDVBr6mKbRvohxheJ9h1,86.0,r&b en espanol
Katy Perry,6jJ0s89eD6GaHleKKya26X,86.0,"dance pop, pop"
Shawn Mendes,7n2wHs1TKAczGzO7Dd2rGr,86.0,"canadian pop, dance pop, pop, viral pop"
Tyler the Creator,4V8LLVI7PbaPR0K2TGSxFF,86.0,"hip hop, rap"
Young Thug,50co4Is1HCEo8bhOyUWKpn,86.0,"atl hip hop, atl trap, gangster rap, hip hop, melodic rap, pop rap, rap, southern hip hop, trap"
Sia,5WUlDfRSoLAfcVSX1WnrxN,86.0,"australian dance, australian pop, dance pop, pop"
Queen,1dfeR4HaWDbWqFHLkxsg1d,86.0,"classic rock, glam rock, rock"
Pink,78rUTD7y6Cy67W1RVzYs7t,85.0,
Elton John,3PhoLpVuITZKcymswpck5b,85.0,"glam rock, mellow gold, piano rock"
Frank Ocean,2h93pZq0e7k5yf4dywlkpM,85.0,"hip hop, lgbtq+ hip hop, neo soul"
Zach Bryan,40ZNYROS4zLfyyBSs2PGe2,85.0,oklahoma country
The Kid Laroi,2tIP7SsRs7vjIcLrU85W8J,85.0,"australian hip hop, pop"
OneRepublic,5Pwc4xIPtQLFEnJriah9YJ,85.0,"piano rock, pop"
EOTO,3PhoLpVuITZKcymswpck5b,85.0,"glam rock, mellow gold, piano rock"
Gunna,2hlmm7s2ICUX0LVIhVFlZQ,85.0,"atl hip hop, hip hop, melodic rap, rap, trap"
Olivia Rodrigo,1McMsnEElThX1knmY4oliG,85.0,pop
Joji,3MZsBdqDrRTJihTHQrO6Dq,85.0,"pop, viral pop"
Zach Bryan,40ZNYROS4zLfyyBSs2PGe2,85.0,oklahoma country
Mac Miller,4LLpKhyESsyAXpc4laK94U,85.0,"hip hop, pittsburgh rap, rap"
Marshmello,64KEffDW9EtZ1y2vBYgq8T,85.0,"brostep, dance pop, edm, pop, pop dance, progressive electro house"
Snoop Dogg,7hJcb9fa4alzcOq3EaNPoG,85.0,"g funk, gangster rap, hip hop, pop rap, rap, west coast rap"
Gorillaz,3AA28KZvwAUcZuOKwyblJQ,85.0,alternative hip hop
50 Cent,3q7HBObVc0L8jNeTe5Gofh,85.0,"east coast hip hop, gangster rap, hip hop, pop rap, queens hip hop, rap"
Farruko,329e4yvIujISKGKz1BZZbO,85.0,"latin hip hop, reggaeton, trap latino, urbano latino"
Halsey,26VFTg2z8YR0cCuwLzESi2,85.0,"dance pop, electropop, etherpop, indie poptimism, pop"
Pitbull,0TnOYISbd1XYRBk9myaseg,84.0,"dance pop, miami hip hop, pop, pop rap"
P!nk,1KCSPY1glIKqW2TotWuXOR,84.0,"dance pop, pop"
Red Hot Chili Peppers,0L8ExT028jH3ddEcZwqJJ5,84.0,"alternative rock, funk metal, funk rock, permanent wave"
Trippie Redd,6Xgp2XMz1fhVYe7i6yNAax,84.0,"melodic rap, rap, trap"
Metallica,2ye2Wgw4gimLv2eAKyk1NB,84.0,"hard rock, metal, old school thrash, rock, thrash metal"
Lil Durk,3hcs9uc56yIGFCSy9leWe7,84.0,"chicago drill, chicago rap, drill, hip hop, rap, trap"
A Boogie Wit Da Hoodie,31W5EY0aAly4Qieq6OFu6I,84.0,"melodic rap, rap"
Playboi Carti,699OTQXzgjhIYAHMy9RyPD,84.0,"atl hip hop, hip hop, plugg, pluggnb, rap"
Black Eyed Peas,1yxSLGMDHlW21z4YXirZDS,83.0,"dance pop, pop, pop rap"
Lewis Capaldi,4GNC7GD6oZMSxPGyXy4MNB,83.0,"pop, uk pop"
Avicii,1vCWHaC5f2uS3yhpwWbIA6,83.0,"dance pop, edm, pop, pop dance, pop rap"
A$AP Rocky,13ubrt8QOOCPljQ2FL1Kca,83.0,"east coast hip hop, hip hop, rap, trap"
Cigarettes After Sex,1QAJqy2dA3ihHBFIHRphZj,83.0,"ambient pop, dream pop, el paso indie, pop, shoegaze"
James,4IWBUUAFIplrNtaOHcJPRM,83.0,"pop, talent show, uk pop"
James Arthur,4IWBUUAFIplrNtaOHcJPRM,83.0,"pop, talent show, uk pop"
Wiz Khalifa,137W8MRPWKqSmrBGDBFSop,83.0,"dance pop, hip hop, pittsburgh rap, pop rap, rap, southern hip hop, trap"
Tory Lanex,2jku7tDXc6XoB6MO2hFuqg,83.0,"canadian hip hop, canadian trap, melodic rap, pop rap, r&b, rap, toronto rap, trap"
Camila Cabello,4nDoRrQiYLoBzwC5BhVJzF,83.0,"dance pop, pop, post-teen pop"
Kodak Black,46SHBwWsqBkxI7EeeBEQG7,83.0,"florida drill, florida rap, hip hop, melodic rap, miami hip hop, rap, trap, trap latino"
Daft Punk,4tZwfgrHOc3mvqYlEYSvVi,83.0,"electro, filter house"
Dababy,4r63FhuTkUYltbVAg5TQnk,83.0,"north carolina hip hop, rap, trap"
Nicky Jam,1SupJlEpv7RS2tPNRaHViT,82.0,"latin hip hop, reggaeton, urbano latino"
Twenty One Pilots,3YQKmKGau1PzlVlkL1iodx,82.0,"modern rock, rock"
Mac DeMarco,3Sz7ZnJQBIHsXLUSo0OQtM,82.0,"edmonton indie, lo-fi indie"
Tame Impala,5INjqkS1o8h1imAzPqGZBb,82.0,"australian psych, neo-psychedelic"
Hozier,2FXC3k01G6Gw61bmprjgqS,82.0,"irish singer-songwriter, pop"
Don Omar,33ScadVnbm2X8kkUqOkC6Z,82.0,"latin hip hop, puerto rican pop, reggaeton, urbano latino"
Fleetwood Mac,08GQAI4eElDnROBrJRGE0X,82.0,"album rock, classic rock, rock, soft rock, yacht rock"
Lil Nas X,7jVv8c5Fj3E9VhNjxT4snq,82.0,"lgbtq+ hip hop, pop"
The Chainsmokers,69GGBxA162lTqCwzJG5jLp,82.0,"dance pop, edm, electropop, pop, pop dance, tropical house"
Sean Paul,3Isy6kedDrgPYoTS1dazA9,82.0,"dance pop, dancehall, pop rap"
Tyga,5LHRHt1k9lMyONurDHEdrp,82.0,"dance pop, hip hop, pop rap, rap, southern hip hop, trap"
Paramore,74XFHRwlV6OrjEM0A2NCMF,82.0,"candy pop, pixie, pop emo, pop punk"
Alan Walker,7vk5e3vY1uw9plTHJAMwjN,82.0,electro house
Kid Cudi,0fA0VVWsXO9YnASrzqfmYu,82.0,"hip hop, ohio hip hop, rap"
Cardi B,4kYSro6naA4h99UJvo89HB,82.0,"dance pop, pop, rap, viral rap"
Ellie Goulding,0X2BH1fck6amBIoJhDVmmJ,82.0,"dance pop, edm, indietronica, metropopolis, pop, uk pop"
Fall Out Boy,4UXqAaa6dQYAk18Lv7PEgX,81.0,"emo, modern rock"
Guns N' Roses,3qm84nBOXUEQ2vnTfUTTFC,81.0,"glam metal, hard rock, rock"
Pharrell Williams,2RdwBSPQiwcmiDo9kixcl8,81.0,"hip hop, pop, pop rap"
System of a Down,5eAWCfyUhZtHHtBdNk56l1,81.0,"alternative metal, nu metal, rap metal"
The 1975,3mIj9lX2MWuHmhNCA7LSCW,81.0,"modern alternative rock, modern rock, pop, rock"
Usher,23zg3TcAtWQy7J6upgbUnj,81.0,"atl hip hop, contemporary r&b, dance pop, pop, r&b, south carolina hip hop, urban contemporary"
Green Day,7oPftvlwr6VrsViSDV7fJY,81.0,"permanent wave, punk"
Childish Gambino,73sIBHcqh3Z3NyqHKZ7FOL,81.0,"atl hip hop, hip hop, pop, rap"
Roddy Ricch,757aE44tKEUQEqRuT6GnEB,81.0,"melodic rap, rap, trap"
Skrillex,5he5w2lnU9x7JFhnwcekXX,81.0,"brostep, complextro, edm, electro"
Ludovico Einaudi,2uFUBdaVGtyMqckSeCl0Qj,81.0,"bow pop, compositional ambient, neo-classical"
Machine Gun Kelly,6TIYQ3jFPwQSRmorSezPxX,81.0,"ohio hip hop, pop, pop rap"
Baby Keem,5SXuuuRpukkTvsLuUknva1,81.0,"hip hop, rap"
Jason Derulo,07YZf4WDAMNwqr4jfgOZ8y,81.0,"dance pop, edm, pop, pop rap, post-teen pop"
Robin Schulz,3t5xRXzsuZmMDkQzgOX35S,81.0,"dance pop, deep euro house, deep house, edm, electro house, german dance, pop, pop dance, pop rap, tropical house"
Burna Boy,3wcj11K77LjEY1PkEazffa,81.0,"afro dancehall, dancehall, nigerian hip hop, nigerian pop"
Kygo,23fqKkggKUBHNkbKtXEls4,81.0,"edm, pop, pop dance, tropical house"
Radiohead,4Z8W4fKeB5YxbusRsdQVPb,81.0,"alternative rock, art rock, melancholia, oxford indie, permanent wave, rock"
Justin Timberlake,31TPClRtHm23RisEBtV3X7,81.0,"dance pop, pop"
Rammstein,6wWVKhxIU2cEi0K81v7HvP,81.0,"alternative metal, german metal, industrial, industrial metal, industrial rock, neue deutsche harte"
070 Shake,12Zk1DFhCbHY6v3xep2ZjI,81.0,new jersey rap
LIZZO,56oDRnqbIiwx4mymNEv7dS,81.0,"dance pop, escape room, minnesota hip hop, pop, trap queen"
Alok,0NGAZxHanS9e0iNHpR8f2W,81.0,"electro house, pop nacional, slap house"
Panic! At The Disco,20JZFwl6HVl6yg8a4H3ZqK,80.0,modern rock
Macklemore,3JhNCzhSMTxs9WLGJJxWOY,80.0,"pop rap, seattle hip hop"
Beck,4obzFoKoKRHIphyHzJ35G3,80.0,"dance pop, latin pop, latin viral pop, pop, rap latina, reggaeton"
John Mayer,0hEurMDQu99nJRq8pTxO14,80.0,"neo mellow, singer-songwriter"
Labrinth,2feDdbD5araYcm6JhFHHw7,80.0,"indie poptimism, pop"
Chris Stapleton,4YLtscXsxbVgi031ovDDdh,80.0,"contemporary country, outlaw country"
Slipknot,05fG473iIaoy82BF1aGhL8,80.0,"alternative metal, nu metal, rap metal"
Foo Fighters,7jy3rLJdDQY21OgRLCZ9sD,80.0,"alternative metal, alternative rock, modern rock, permanent wave, post-grunge, rock"
Becky G,4obzFoKoKRHIphyHzJ35G3,80.0,"dance pop, latin pop, latin viral pop, pop, rap latina, reggaeton"
Megan Thee Stallion,181bsRPaVXVlUKXrxwZfHK,80.0,"dance pop, houston rap, pop, rap, trap queen"
Deftones,6Ghvu1VvMGScGpOUJBAHNH,80.0,"alternative metal, nu metal, rap metal, rock, sacramento indie"
The Rolling Stones,22bE4uQ6baNwSHPVcDxLCe,80.0,"british invasion, classic rock, rock"
Lil Yachty,6icQOAFXDZKsumw3YXyusw,80.0,"atl hip hop, melodic rap, rap, trap, viral rap"
Tv Girl,0Y6dVaC9DZtPNH4591M42W,80.0,indie pop
DJ Snake,540vIaP2JwjQb9dm3aArA4,79.0,"dance pop, edm, electronic trap, pop, pop dance, pop rap"
Russ,1z7b1Pr1rSlvWRzsW3HOrS,79.0,"hawaiian hip hop, rap"
Diplo,5fMUXHkw8R8eOP2RNVYEZX,79.0,"edm, electro house, house, moombahton, pop, pop dance, tropical house"
Tom Odell,2txHhyCwHjUEpJjWrEyqyX,79.0,"chill pop, pop"
Martin Garrix,60d24wfXkVzDSfLS6hyCjZ,79.0,"dance pop, dutch edm, edm, electro house, pop, pop dance, progressive house, tropical house"
Migos,6oMuImdp5ZcFhWP0ESe6mG,79.0,"atl hip hop, hip hop, pop rap, rap, trap"
Anne-Marie,1zNqDE7qDGCsyzJwohVaoX,79.0,"dance pop, pop, pop dance, post-teen pop, tropical house, uk pop"
John Legend,5y2Xq6xcjJb2jVM54GHK3t,79.0,"neo mellow, neo soul, pop, pop soul, r&b, urban contemporary"
Dean Lewis,3QSQFmccmX81fWCUSPTS7y,79.0,"australian pop, pop"
My Chemical Romance,7FBcuc1gsnv6Y1nwFtNRCb,79.0,"emo, pop punk"
Big Sean,0c173mlxpT3dSFRgMO8XPh,79.0,"dance pop, detroit hip hop, hip hop, pop, pop rap, r&b, rap, southern hip hop, trap"
Blink-182,6FBDaR13swtiWwGhX1WQsP,79.0,"pop punk, punk, rock, socal pop punk"
WIZKID,3tVQdUvClmAT7URs9V3rsp,79.0,"afro dancehall, afropop, azonto, nigerian hip hop, nigerian pop"
Gucci Mane,13y7CgLHjMVRMDqxdx0Xdo,79.0,"atl hip hop, dirty south rap, gangster rap, hip hop, pop rap, rap, southern hip hop, trap"
Glass Animals,4yvcSjfu4PC0CYQyLy4wSq,79.0,"gauze pop, indietronica, shiver pop"
Alicia Keys,3DiDSECUqqY1AuBP8qtaIa,79.0,"hip pop, neo soul, pop, r&b, urban contemporary"
Jhené Aiko,5ZS223C6JyBfXasXxrRqOk,79.0,"pop, r&b, urban contemporary"
Phoebe Bridgers,1r1uxoy19fzMxunt3ONAkG,79.0,"indie pop, la indie"
Maná,7okwEbXzyT2VffBmyQBWLz,79.0,"latin arena pop, latin pop, latin rock, mexican pop, mexican rock, rock en espanol"
T-Pain,3aQeKQSyrW4qWr35idm0cy,79.0,"dance pop, hip hop, pop rap, r&b, rap, southern hip hop, urban contemporary"
Christina Aguilera,1l7ZsJRRS8wlW3WfJfPfNS,79.0,"dance pop, pop, post-teen pop"
Bon Jovi,58lV9VcRSjABbAbfWS6skp,79.0,"glam metal, rock"
5 Seconds of Summer,5Rl15oVamLq7FbSb0NNBNy,79.0,"boy band, dance pop, pop, post-teen pop"
Bring Me The Horizon,1Ffb6ejR6Fe5IamqA5oRUF,79.0,"melodic metalcore, metalcore, rock, uk metalcore"
The Killers,0C0XlULifJtAgn6ZNCW2eu,78.0,"alternative rock, dance rock, modern rock, permanent wave, rock"
Ludacris,3ipn9JLAPI5GUEo4y4jcoi,78.0,"atl hip hop, dance pop, dirty south rap, hip hop, old school atlanta hip hop, pop rap, rap, southern hip hop, trap"
Billy Joel,6zFYqv1mOsgBRQbae3JJ9e,78.0,"classic rock, folk rock, mellow gold, piano rock, rock, singer-songwriter, soft rock"
Rex Orange County,7pbDxGE6nQSZVfiFdq9lOL,78.0,"bedroom pop, pop"
6LACK,4IVAbR2w4JJNJDDRFP3E83,78.0,"atl hip hop, hip hop, melodic rap, pop, r&b, rap, trap"
Depeche Mode,762310PdDnwsDxAQxzQkfX,78.0,"dance rock, new romantic, new wave, permanent wave, synthpop"
R3hab,6cEuCEZu7PAE9ZSzLLc2oQ,78.0,"dance pop, dutch house, edm, electro house, pop, pop dance, progressive electro house, slap house, tropical house"
The Lumineers,16oZKvXb6WkQlVAjwo2Wbg,78.0,"folk-pop, pop, stomp and holler"
Zara Larsson,1Xylc3o4UrD53lo9CvFvVg,78.0,"dance pop, edm, pop, pop dance, post-teen pop, scandipop, swedish electropop, swedish pop, tropical house"
Hans Zimmer,0YC192cP3KPCRWx8zr8MfZ,78.0,"german soundtrack, orchestral soundtrack, soundtrack"
Whitney,6XpaIBNiVzIetEPCWDvAFP,78.0,"dance pop, pop"
The Offspring,5LfGQac0EIXyAN8aUwmNAQ,78.0,"alternative metal, permanent wave, punk, rock, skate punk, socal pop punk"
Felix Jaehn,4bL2B6hmLlMWnUEZnorEtG,78.0,"dance pop, edm, electro house, german dance, pop, pop dance, tropical house"
Lost Frequencies,7f5Zgnp2spUuuzKplmRkt7,78.0,"belgian edm, edm, pop, pop dance, tropical house"
Lorde,163tK9Wjr9P9DmM0AVK7lm,78.0,"art pop, metropopolis, nz pop, pop"
Rick Ross,1sBkRIssrMs1AbVkOJbc7a,78.0,"dirty south rap, gangster rap, hip hop, pop rap, rap, southern hip hop, trap"
The Strokes,0epOFNiUfyON9EYx7Tpr6V,78.0,"alternative rock, garage rock, modern rock, permanent wave, rock"
beabadoobee,35l9BRT7MXmM8bv2WDQiyB,78.0,"bedroom pop, bubblegrunge, indie pop, pop"
Tyler Childers,13ZEDW6vyBF12HYcZRr4EV,78.0,"kentucky indie, kentucky roots, outlaw country"
Aerosmith,7Ey4PD4MYsKc5I2dolUwbH,78.0,"album rock, classic rock, hard rock, rock"
Jonas Blue,1HBjj22wzbscIZ9sEb5dyf,77.0,"dance pop, edm, pop, pop dance, tropical house, uk dance"
Alesso,4AVFqumd2ogHFlRbKIjp1t,77.0,"dance pop, edm, electro house, pop, pop dance, progressive electro house, tropical house"
Swedish House Mafia,1h6Cn3P4NGzXbaXidqURXs,77.0,"dance pop, edm, electro house, pop, pop dance, progressive electro house"
Muse,12Chz98pHFMPJEknJQMWvI,77.0,"modern rock, permanent wave, rock"
Vance Joy,10exVja0key0uqUkk6LJRT,77.0,"folk-pop, pop"
Jonas Brothers,7gOdHgIoIKoe4i9Tta6qdD,77.0,"boy band, dance pop, pop, post-teen pop"
Prince Royce,3MHaV05u0io8fQbZ2XPtlC,77.0,"bachata, latin hip hop"
Steve Akoi,77AiFEVeAVj2ORpC85QVJs,77.0,"dance pop, edm, electro house, pop dance, pop rap, tropical house"
Luke Bryan,0BvkDsjIUla7X0k6CSWh1I,77.0,"contemporary country, country, country road"
George Ezra,2ysnwxxNtSgbb9t1m2Ur4j,77.0,"folk-pop, neo-singer-songwriter"
Bruce Springsteen,3eqjTLE0HfPfh78zjh6TqT,77.0,"classic rock, heartland rock, mellow gold, permanent wave, rock, singer-songwriter"
Little Mix,3e7awlrlDSwF3iM0WBjGMp,77.0,"dance pop, girl group, pop, post-teen pop, talent show, uk pop"
Zedd,2qxJFvFYMEDqd7ui6kSAcq,77.0,"complextro, dance pop, edm, electro house, german techno, pop, pop dance, pop rap, post-teen pop, tropical house"
Backstreet Boys,5rSXSAkZ67PYJSvpUpkOr7,77.0,"boy band, dance pop"
Eagles,0ECwFtbIWEVNwjlrfc6xoL,77.0,"album rock, classic rock, country rock, folk rock, heartland rock, mellow gold, rock, soft rock, yacht rock"
Korn,3RNrq3jvMZxD9ZyoOZbQOD,77.0,"alternative metal, funk metal, nu metal, rap metal, rock"
Florence + the Machine,1moxjboGR7GNWYIMWsRjgG,77.0,"baroque pop, pop, uk alternative pop"
Florence and the Machine,1moxjboGR7GNWYIMWsRjgG,77.0,"baroque pop, pop, uk alternative pop"
Noah Kahan,2RQXRUsr4IW1f3mKyKsy4B,77.0,pop
Tove Lo,4NHQUGzhtTLFvgF5SZesLK,77.0,"dance pop, electropop, metropopolis, pop, swedish electropop, swedish pop, swedish synthpop"
The Cure,7bu3H8JO7d0UbMoVzbo70s,77.0,"new wave, permanent wave, rock, uk post-punk"
Clairo,3l0CmX0FuQjFxr8SK7Vqag,77.0,"bedroom pop, indie pop, pop"
Steve Aoki,77AiFEVeAVj2ORpC85QVJs,77.0,"dance pop, edm, electro house, pop dance, pop rap, tropical house"
Ice Cube,3Mcii5XWf6E0lrY3Uky4cA,77.0,"conscious hip hop, g funk, gangster rap, hip hop, rap, west coast rap"
Stevie Wonder,7guDJrEfX3qb6FEbdPA5qi,77.0,"adult standards, funk, motown, quiet storm, soul"
Juanes,0UWZUmn7sybxMCqrw9tGa7,77.0,"colombian pop, latin pop, mexican pop, rock en espanol, tropical"
2 Chainz,17lzZA2AlOHwCwFALHttmp,77.0,"atl hip hop, gangster rap, hip hop, pop rap, rap, southern hip hop, trap"
Kehlani,0cGUm45nv7Z6M6qdXYQGTX,77.0,"dance pop, pop, r&b, rap"
Jack Johnson,3GBPw9NK25X1Wt2OUvOwY3,77.0,neo mellow
Charli XCX,25uiPmTg16RbhZWAqwLBy5,77.0,"art pop, candy pop, dance pop, electropop, metropopolis, pop, post-teen pop, uk pop"
Avril Lavigne,0p4nmQO2msCgU4IF37Wi3j,77.0,"canadian pop, candy pop, dance pop, pop, post-teen pop"
Chance The Rapper,1anyVhU62p31KFi8MEzkbf,76.0,"chicago rap, conscious hip hop, hip hop, pop rap, rap"
Nelly,2gBjLmx6zQnFGQJCAQpRgw,76.0,"dance pop, hip hop, pop rap, southern hip hop, st louis rap"
Nas,20qISvAhX20dpIbOOzGK3q,76.0,"conscious hip hop, east coast hip hop, gangster rap, hardcore hip hop, hip hop, queens hip hop, rap"
Limp Bizkit,165ZgPlLkK7bf5bDoFc6Sb,76.0,"alternative metal, funk metal, nu metal, rap metal"
Major Lazer,738wLrAtLtCtFOLvQBXOXp,76.0,"dance pop, edm, electro house, moombahton, pop, pop dance, pop rap, tropical house"
Avenged Sevenfold,0nmQIMXWTXfhgOBdNzhGOs,76.0,alternative metal
Jessie Reyez,3KedxarmBCyFBevnqQHy3P,76.0,"canadian contemporary r&b, canadian pop, pop, r&b"
Girl In Red,3uwAm6vQy7kWPS2bciKWx9,76.0,"bedroom pop, indie pop, norwegian indie, pop"
Bryan Adams,3Z02hBLubJxuFJfhacLSDc,76.0,"canadian pop, canadian singer-songwriter, classic canadian rock, heartland rock, mellow gold, soft rock"
Five Finger Death Punch,5t28BP42x2axFnqOOMg3CM,76.0,"alternative metal, groove metal, nu metal"
Three Days Grace,2xiIXseIJcq3nG7C8fHeBj,76.0,"alternative metal, canadian metal, canadian rock, nu metal, post-grunge"
Aurora,1WgXqy2Dd70QQOU7Ay074N,76.0,"art pop, norwegian pop"
Disturbed,3TOqt5oJwL9BE2NG9MEwDa,76.0,"alternative metal, nu metal, rap metal"
G-Eazy,02kJSzxNuaWGqwubyUba0Z,76.0,"hip hop, indie pop rap, oakland hip hop, pop, pop rap, rap"
Bastille,7EQ0qTo7fWT7DPxmxtSYEc,76.0,"metropopolis, modern rock, pop, pop rock, tropical house"
Alessia Cara,2wUjUUtkb5lvLKcGKsKqsR,76.0,"canadian contemporary r&b, canadian pop, dance pop, pop, post-teen pop"
Bon Iver,4LEiUm1SRbFMgfqnQTwUbQ,76.0,"eau claire indie, indie folk, melancholia"
Falling In Reverse,2CmaKO2zEGJ1NWpS1yfVGz,76.0,"modern rock, rap metal"
Ski Mask The Slump God,2rhFzFmezpnW82MNqEKVry,76.0,"miami hip hop, rap"
Pearl Jam,1w5Kfo2jwwIPruYS2UWh56,76.0,"grunge, permanent wave, rock"
Kevin Gates,1gPhS1zisyXr5dHTYZyiMe,76.0,"baton rouge rap, pop rap, rap, southern hip hop, trap"
AJR,6s22t5Y3prQHyaHWUN1R1C,76.0,"modern rock, pop rock"
Clean Bandit,6MDME20pz9RveH9rEXvrOM,76.0,"dance pop, edm, pop, pop dance, pop rap, post-teen pop, tropical house, uk dance, uk funky"
Luis Fonsi,4V8Sr092TqfHkfAA5fXXqG,76.0,"latin pop, puerto rican pop"
Outkast,1G9G7WwrXka3Z1r7aIDjI7,76.0,"atl hip hop, dirty south rap, hip hop, old school atlanta hip hop, pop rap, rap, southern hip hop"
Kings of Leon,2qk9voo8llSGYcZ6xrBzKx,76.0,"modern rock, rock"
Celine Dion,4S9EykWXhStSc15wEx8QFK,76.0,canadian pop
Iron Maiden,6mdiAmATAx73kdxrNrnlao,75.0,"hard rock, metal, nwobhm, rock"
MGMT,0SwO7SWeDHJijQ3XNS7xEE,75.0,"alternative dance, indietronica, modern rock, rock"
Willow,3rWZHrfrsPBxVy692yAIxF,75.0,"afrofuturism, pop, post-teen pop"
Marina and The Diamonds,6CwfuxIqcltXDGjfZsMd9A,75.0,"dance pop, electropop, metropopolis, pop, uk alternative pop"
Shaggy,5EvFsr3kj42KNv97ZEnqij,75.0,"dance pop, pop rap, reggae fusion"
Illenium,45eNHdiiabvmbp4erw26rg,75.0,"edm, melodic dubstep, pop, pop dance"
Pierce the Veil,4iJLPqClelZOBCBifm8Fzv,75.0,screamo
LANY,49tQo2QULno7gxHutgccqF,75.0,"la pop, pop"
Galantis,4sTQVOfp9vEMCemLw50sbu,75.0,"dance pop, edm, electro house, pop, pop dance, tropical house"
Cage the Elephant,26T3LtbuGT1Fu9m0eRq5X3,75.0,"modern rock, punk blues, rock"
Armin Van Buuren,0SfsnGyD8FpIN4U4WCkBZ5,75.0,"dutch trance, edm, pop dance, progressive house, trance"
Jason Aldean,3FfvYsEGaIb52QPXhg4DcH,75.0,"contemporary country, country, country road"
Beach House,56ZTgzPBDge0OvCGgMO3OY,75.0,"baltimore indie, dream pop, dreamo, modern dream pop"
The Script,3AQRLZ9PuTAozP28Skbq8V,75.0,"celtic rock, dance pop, neo mellow, pop, pop rock"
Rita Ora,5CCwRZC6euC8Odo6y9X8jr,75.0,"dance pop, edm, electropop, pop, pop rap, post-teen pop, tropical house, uk pop"
Shania Twain,5e4Dhzv426EvQe3aDb64jL,75.0,"canadian country, canadian pop, country, country dawn, dance pop"
Black Sabbath,5M52tdBnJaKSvOpJGz8mfZ,75.0,"album rock, birmingham metal, classic rock, hard rock, metal, rock, stoner rock, uk doom metal"
MARINA,6CwfuxIqcltXDGjfZsMd9A,75.0,"dance pop, electropop, metropopolis, pop, uk alternative pop"
Eric Church,2IvkS5MXK0vPGnwyJsrEyV,75.0,"contemporary country, country, country road"
Jax Jones,4Q6nIcaBED8qUel8bBx6Cr,75.0,"dance pop, edm, electro house, house, pop, pop dance, pop rap, tropical house, uk dance"
Michael Bublé,1GxkXlMwML1oSg5eLPiAz3,75.0,"adult standards, canadian pop, jazz pop, lounge"
X Ambassadors,3NPpFNZtSTHheNBaWC82rB,75.0,"modern alternative rock, modern rock, pop, pop rap, pop rock, rock, stomp pop"
Skillet,49bzE5vRBRIota4qeHtQM8,75.0,"alternative metal, christian alternative rock, christian music, christian rock"
Thomas Rhett,6x2LnllRG5uGarZMsD4iO8,75.0,"contemporary country, country, country road"
Thundercat,4frXpPxQQZwbCu3eTGnZEw,75.0,afrofuturism
Stormzy,2SrSdSvpminqmStGELCSNd,75.0,"grime, uk hip hop"
Tears for Fears,4bthk9UfsYUYdcFyqxmSUU,75.0,"new romantic, new wave, new wave pop, permanent wave, pop rock, rock, soft rock, sophisti-pop, synthpop"
Rae Sremmurd,7iZtZyCzp3LItcw1wtPI3D,74.0,"hip hop, melodic rap, mississippi hip hop, pop rap, rap, southern hip hop, trap, viral rap"
Zac Brown Band,6yJCxee7QumYr820xdIsjo,74.0,"contemporary country, country, country road, modern country rock"
Disclosure,6nS5roXSAGhTGr34W6n7Et,74.0,"edm, house, pop, uk dance"
Timmy Trumpet,0CbeG1224FS58EUx4tPevZ,74.0,"australian dance, big room, edm, electro house, melbourne bounce, melbourne bounce international, pop dance"
Flume,6nxWCVXbOlEVRexSbLsTer,74.0,"australian dance, australian electropop, australian indie, downtempo, edm"
Scorpions,27T030eWyCQRmDyuvr1kxY,74.0,"album rock, german hard rock, german metal, german rock, hard rock, metal, rock"
Carly Rae Jepsen,6sFIWsNpZYqfjUpaCgueju,74.0,"canadian pop, dance pop, electropop, pop, post-teen pop"
Kiss,07XSN3sPlIlB2L2XNcTwJw,74.0,"album rock, glam rock, hard rock, metal, rock"
Van Morrison,44NX2ffIYHr6D4n7RaZF7A,74.0,"classic rock, folk, folk rock, mellow gold, rock, roots rock, singer-songwriter, soft rock"
Weezer,3jOstUTkEu2JkjvRdBA5Gu,74.0,"alternative rock, modern power pop, modern rock, permanent wave, rock"
Lord Huron,6ltzsmQQbmdoHHbLZ4ZN25,74.0,stomp and holler
Norah Jones,2Kx7MNY7cI1ENniW7vT30N,74.0,"adult standards, contemporary vocal jazz, jazz pop, neo mellow"
Train,3FUY2gzHeIiaesXtOAdB7A,74.0,"dance pop, neo mellow, pop, pop rock"
Afrojack,4D75GcNG95ebPtNvoNVXhz,74.0,"big room, dance pop, dutch house, edm, electro house, pop dance, pop rap, progressive house, tropical house"
The Smashing Pumpkins,40Yq4vzPs9VNUrIBG5Jr2i,74.0,"alternative metal, alternative rock, grunge, permanent wave, pop rock, rock, spacegrunge"
Papa Roach,4RddZ3iHvSpGV4dvATac9X,74.0,"alternative metal, nu metal, rap metal, rap rock"
Dominic Fike,6USv9qhCn6zfxlBQIYJ9qs,74.0,"alternative pop rock, pop"
Rod Stewart,2y8Jo9CKhJvtfeKOsYzRdT,74.0,"classic rock, mellow gold, soft rock"
Rainbow Kitten Surprise,4hz8tIajF2INpgM0qzPJz2,74.0,modern rock
Denzel Curry,6fxyWrfmjcbj5d12gXeiNV,74.0,"dark trap, drill, hip hop, miami hip hop, rap, underground hip hop"
Mumford & Sons,3gd8FJtBJtkRxdfbTu19U2,74.0,"modern folk rock, stomp and holler, uk americana"
Keane,53A0W3U0s8diEn9RhXQhVz,74.0,"neo mellow, piano rock, pop rock"
