artistName,artistID,artistPop,artistGenre
George Strait,5vngPClqofybhPERIqQMYd,74.0,"contemporary country, country, country road, country rock"
Ms. Lauryn Hill,2Mu5NfyYm8n5iTomuKAEHl,74.0,"alternative r&b, conscious hip hop, neo soul, new jersey rap, r&b, urban contemporary"
Maren Morris,6WY7D3jk8zTrHtmkqqo5GI,74.0,"contemporary country, country, pop, texas country"
Milky Chance,1hzfo8twXdOegF3xireCYs,74.0,german pop
Carrie Underwood,4xFUf1FHVy696Q1JQZMTRj,74.0,"contemporary country, country, country dawn, oklahoma country, pop"
Toto,0PFtn5NtBbbUNbU9EAmIWF,74.0,"album rock, classic rock, mellow gold, rock, soft rock, yacht rock"
Diljit Dosanjh,2FKWNmZWDBZR4dE5KX4plR,74.0,"desi pop, filmi, modern bollywood"
Stromae,5j4HeCoUlzhfWtjAfM1acR,74.0,"belgian pop, g-house"
Lynyrd Skynyrd,4MVyzYMgTwdP7Z49wAZHx0,74.0,"album rock, blues rock, classic rock, country rock, hard rock, mellow gold, rock, southern rock"
Skepta,2p1fiYHYiXz9qi0JJyxBzN,74.0,"birmingham grime, grime, instrumental grime"
Jon Pardi,4MoAOfV4ROWofLG3a3hhBN,74.0,"contemporary country, country, country road, modern country rock"
Lil Jon,7sfl4Xt5KmfyDs2T3SVSMK,74.0,"atl hip hop, crunk, dance pop, dirty south rap, old school atlanta hip hop, pop rap, southern hip hop"
Rufus Du Sol,5Pb27ujIyYb33zBqVysBkj,73.0,"australian electropop, edm, indietronica"
Jorja Smith,1CoZyIx7UvdxT5c8UkMzHd,73.0,"pop, r&b, uk contemporary r&b"
The Beach Boys,3oDbviiivRWhXwIE8hxkVV,73.0,"adult standards, baroque pop, classic rock, psychedelic rock, rock, sunshine pop"
Rage Against The Machine,2d0hyoQ5ynDBnkvAbJKORj,73.0,"alternative metal, alternative rock, conscious hip hop, funk metal, nu metal, political hip hop, rap metal, rap rock, rock"
RÜFÜS DU SOL,5Pb27ujIyYb33zBqVysBkj,73.0,"australian electropop, edm, indietronica"
Ozzy Osbourne,6ZLTlhejhndI4Rh53vYhrY,73.0,"album rock, birmingham metal, hard rock, metal, rock"
Tim McGraw,6roFdX1y5BYSbp60OTJWMd,73.0,"contemporary country, country, country road"
Evanescence,5nGIFgo0shDenQYSE0Sn7c,73.0,alternative metal
James Bay,4EzkuveR9pLvDVFNx6foYD,73.0,"neo mellow, pop, pop rock"
Goo Goo Dolls,2sil8z5kiy4r76CRTXxBCA,73.0,"neo mellow, permanent wave, pop rock"
Leon Bridges,3qnGvpP8Yth1AqSBMqON5x,73.0,"modern blues, soul"
Pusha T,0ONHkAv9pCAFxb0zJwDNTy,73.0,"alternative hip hop, gangster rap, hip hop, pop rap, rap, southern hip hop, trap, underground hip hop, virginia hip hop"
A$AP Ferg,5dHt1vcEm9qb8fCyLcB3HL,73.0,"gangster rap, hip hop, pop rap, rap, southern hip hop, trap, underground hip hop"
Pixies,6zvul52xwTWzilBZl6BUbT,73.0,"alternative rock, boston rock, modern rock, permanent wave, rock"
The Goo Goo Dolls,2sil8z5kiy4r76CRTXxBCA,73.0,"neo mellow, permanent wave, pop rock"
Bad Omens,3Ri4H12KFyu98LMjSoij5V,73.0,american metalcore
Mötley Crüe,0cc6vw3VN8YlIcvr1v7tBL,73.0,"glam metal, hard rock, metal, rock, sleaze rock"
Breaking Benjamin,5BtHciL0e0zOP7prIHn3pP,73.0,"alternative metal, nu metal, post-grunge"
Sum 41,0qT79UgT5tY4yudH9VfsdT,73.0,"canadian pop punk, canadian punk, punk"
Busta Rhymes,1YfEcTuGvBQ8xSD1f53UnK,73.0,"east coast hip hop, hardcore hip hop, hip hop, hip pop, pop rap, rap"
Jessie J,2gsggkzM5R49q6jpPvazou,73.0,"dance pop, pop, pop rap, post-teen pop"
Willie Nelson,5W5bDNCqJ1jbCgTxDD0Cb3,73.0,"classic country pop, country, country rock, nashville sound, outlaw country, singer-songwriter, texas country"
Empire of the Sun,67hb7towEyKvt5Z8Bx306c,73.0,"alternative dance, australian dance, australian electropop, dance rock, indietronica, neo-synthpop"
Dannylux,6ElqtIfQsAkEYypgfJIjeK,73.0,"corridos tumbados, nueva musica mexicana, sad sierreno"
Ashanti,5rkVyNGXEgeUqKkB5ccK83,73.0,"dance pop, hip hop, hip pop, r&b, urban contemporary"
Sam Hunt,2kucQ9jQwuD8jWdtR9Ef38,73.0,"contemporary country, country, country pop, country road"
Miranda Lambert,66lH4jAE7pqPlOlzUKbwA0,73.0,"contemporary country, country, country dawn, country road"
Jess Glynne,4ScCswdRlyA23odg9thgIO,73.0,"dance pop, neo mellow, pop, pop dance, post-teen pop, tropical house, uk pop"
Ken Carson,3gBZUcNeVumkeeJ19CY2sX,73.0,
M83,63MQldklfxkjYDoUE4Tppz,73.0,"french shoegaze, french synthpop, indietronica, metropopolis, neo-synthpop"
All Time Low,46gyXjRIvN1NL1eCB8GBxo,73.0,"modern rock, pop punk, rock"
Motley Crue,0cc6vw3VN8YlIcvr1v7tBL,73.0,"glam metal, hard rock, metal, rock, sleaze rock"
Santana,6GI52t8N5F02MxU0g5U69P,73.0,"blues rock, classic rock, mexican classic rock"
Alice in Chains,64tNsm6TnZe2zpcMVMOoHL,73.0,"alternative metal, alternative rock, grunge, hard rock, nu metal, rock"
Birdy,2WX2uTcsvV5OnS0inACecP,73.0,pop
Bob Dylan,74ASZWbe4lXaubB36ztrGX,73.0,"classic rock, country rock, folk, folk rock, mellow gold, rock, roots rock, singer-songwriter"
a-ha,2jzc5TC5TVFLXQlBNiIUzE,73.0,"new romantic, new wave, new wave pop, permanent wave, pop rock, soft rock, synthpop"
Men I Trust,3zmfs9cQwzJl575W1ZYXeT,73.0,indie pop
Alan Jackson,4mxWe1mtYIYfP040G38yvS,73.0,"country, country road"
Yung Gravy,2YOYua8FpudSEiB9s88IgQ,73.0,minnesota hip hop
Vintage Culture,28uJnu5EsrGml2tBd7y8ts,73.0,brazilian edm
John Williams,3dRfiJ2650SZu6GbydcHNb,73.0,"orchestral soundtrack, soundtrack"
Sting,0Ty63ceoRnnJKVEYP0VQpk,72.0,"permanent wave, soft rock, sophisti-pop"
Oliver Heldens,5nki7yRhxgM509M5ADlN1p,72.0,"dance pop, edm, electro house, future house, house, pop dance, progressive electro house, progressive house, tropical house"
Megadeth,1Yox196W7bzVNZI7RBaPnf,72.0,"alternative metal, hard rock, melodic thrash, metal, old school thrash, rock, speed metal, thrash metal"
Ella Mai,7HkdQ0gt53LP4zmHsL0nap,72.0,"dance pop, pop, r&b, rap, uk contemporary r&b, urban contemporary"
Mary J. Blige,1XkoF8ryArs86LZvFOkbyr,72.0,"dance pop, hip pop, neo soul, r&b, urban contemporary"
Yungblud,6Ad91Jof8Niiw0lGLLi3NW,72.0,"british indie rock, modern rock, rock"
Shinedown,70BYFdaZbEKbeauJ670ysI,72.0,"alternative metal, nu metal, post-grunge"
Kenny Chesney,3grHWM9bx2E9vwJCdlRv9O,72.0,"contemporary country, country, country road"
Lukas Graham,25u4wHJWxCA9vO0CzxAbK7,72.0,"danish pop, pop, scandipop"
Khruangbin,2mVVjNmdjXZZDvhgQWiakk,72.0,neo-psychedelic
Volbeat,0L5fC7Ogm2YwgqVCRcF1bT,72.0,"alternative metal, danish metal, danish rock"
Odesza,21mKp7DqtSNHhCAU2ugvUw,72.0,"chillwave, edm"
Alt-J,3XHO7cRUPCLOr6jwp8vsx5,72.0,"indie rock, modern rock"
Ashnikko,3PyJHH2wyfQK3WZrk9rpmP,72.0,"dance pop, electropop, escape room, pop"
Latto,3MdXrJWsbVzdn6fe5JYkSQ,72.0,"pop, r&b, rap, trap queen"
Keith Urban,0u2FHSq3ln94y5Q57xazwf,72.0,"australian country, australian pop, contemporary country, country, country road"
Blake Shelton,1UTPBmNbXNTittyMJrNkvw,72.0,"contemporary country, country, country road, oklahoma country"
Passenger,0gadJ2b9A4SKsB1RFkBb66,72.0,"folk-pop, neo mellow"
Foster the People,7gP3bB2nilZXLfPHJhMdvc,72.0,"indietronica, modern rock, rock"
Jeezy,4yBK75WVCQXej1p04GWqxH,72.0,"atl hip hop, crunk, dirty south rap, gangster rap, hip hop, old school atlanta hip hop, pop rap, rap, southern hip hop, trap"
Rise Against,6Wr3hh341P84m3EI8qdn9O,72.0,"chicago hardcore, chicago punk, hardcore punk, punk"
Lionel Richie,3gMaNLQm7D9MornNILzdSl,72.0,"adult standards, disco, mellow gold, soft rock"
The Black Keys,7mnBLXK823vNxN3UWB7Gfz,72.0,"alternative rock, blues rock, garage rock, modern blues rock, modern rock, punk blues, rock, roots rock"
Fetty Wap,6PXS4YHDkKvl1wkIl4V8DL,72.0,"dance pop, new jersey rap, pop, pop rap, rap, southern hip hop, trap"
James Blunt,7KMqksf0UMdyA0UCf4R3ux,72.0,"neo mellow, pop, pop rock"
Dimitri Vegas & Like Mike,73jBynjsVtofjRpdpRAJGk,72.0,"belgian dance, belgian edm, big room, dance pop, edm, electro house, pop dance, progressive electro house, tropical house"
3 Doors Down,2RTUTCvo6onsAnheUk3aL9,72.0,"alternative metal, nu metal, pop rock, post-grunge"
Cheat Codes,7DMveApC7UnC2NPfPvlHSU,72.0,"dance pop, edm, electro house, electropop, pop, pop dance, pop edm, post-teen pop, tropical house"
Andy Grammer,2oX42qP5ineK3hrhBECLmj,72.0,"dance pop, neo mellow, pop, pop rap, pop rock, post-teen pop"
Hillsong United,74cb3MG0x0BOnYNW1uXYnM,72.0,"ccm, christian alternative rock, christian music, world worship, worship"
Dan + Shay,7z5WFjZAIYejWy0NI5lv4T,72.0,"contemporary country, country, country road, pop"
Sean Kingston,6S0dmVVn4udvppDhZIWxCr,71.0,"dance pop, miami hip hop, pop, post-teen pop, rap, urban contemporary"
Billy Idol,7lzordPuZEXxwt9aoVZYmG,71.0,"album rock, classic rock, dance rock, hard rock, mellow gold, new romantic, new wave, new wave pop, rock, soft rock"
Ja Rule,1J2VVASYAamtQ3Bt8wGgA6,71.0,"dance pop, east coast hip hop, gangster rap, hip hop, pop rap, queens hip hop, rap, urban contemporary"
Lee Brice,5Zq7R5qmi58ByYyBQTlNuk,71.0,"contemporary country, country, country road"
Moby,3OsRAKCvk37zwYcnzRf5XF,71.0,"downtempo, electronica"
Coolio,3y24n3XhZ96wgwRXjvS17T,71.0,"g funk, gangster rap, hip hop, rap, west coast rap"
Bl3Nd,4tpUmLEVLCGFr93o8hFFIB,71.0,"candy pop, new wave, new wave pop, permanent wave, power pop, rock"
Sasha,4xnihxcoXWK3UqryOSnbw5,71.0,"alt z, electropop, pop"
deadmau5,2CIMQHirSU0MQqyYHq0eOx,71.0,"canadian electronic, edm, electro house, pop dance, progressive house"
Lenny Kravitz,5gznATMVO85ZcLTkE9ULU7,71.0,"permanent wave, pop rock, rock"
Trey Songz,2iojnBLj0qIMiKPvVhLnsH,71.0,"dance pop, hip pop, pop, r&b, southern hip hop, trap, urban contemporary"
Rag'n'Bone Man,4f9iBmdUOhQWeP7dcAn1pf,71.0,neo soul
Foreigner,6IRouO5mvvfcyxtPDKMYFN,71.0,"album rock, classic rock, hard rock, mellow gold, rock, soft rock"
Blondie,4tpUmLEVLCGFr93o8hFFIB,71.0,"candy pop, new wave, new wave pop, permanent wave, power pop, rock"
Rag’n’Bone Man,4f9iBmdUOhQWeP7dcAn1pf,71.0,neo soul
DEF LEPPARD,6H1RjVyNruCmrBEWRbD0VZ,71.0,"album rock, hard rock, nwobhm, rock"
Kaytranada,6qgnBH6iDM91ipVXv28OMu,71.0,"escape room, lgbtq+ hip hop"
Kodaline,4BxCuXFJrSWGi1KHcVqaU4,71.0,"irish pop, pop, pop rock"
Alex G,6lcwlkAjBPSKnFBZjjZFJs,71.0,"indie pop, philly indie"
Dierks Bentley,7x8nK0m0cP2ksQf0mjWdPS,71.0,"contemporary country, country, country road"
Wu-Tang Clan,34EP7KEpOjXcM2TCat1ISk,71.0,"east coast hip hop, gangster rap, hardcore hip hop, hip hop, rap"
Glorilla,2qoQgPAilErOKCwE2Y8wOG,71.0,"rap, viral rap"
Paloma Faith,4fwuXg6XQHfdlOdmw36OHa,71.0,"british soul, dance pop"
PnB Rock,21WS9wngs9AqFckK7yYJPM,71.0,"melodic rap, pop, pop rap, rap, trap, vapor trap"
ZZ Top,2AM4ilv6UzW0uMRuqKtDgN,71.0,"album rock, blues rock, classic rock, country rock, hard rock, rock"
Motionless in White,6MwPCCR936cYfM1dLsGVnl,71.0,"alternative metal, metalcore"
Paul McCartney,4STHEaNw4mPZ2tzheohgXB,71.0,"album rock, art rock, beatlesque, classic rock, folk rock, mellow gold, rock, soft rock"
Wale,67nwj3Y5sZQLl72VNUHEYE,71.0,"gangster rap, hip hop, pop rap, r&b, rap, southern hip hop, trap, urban contemporary"
Blur,7MhMgCo0Bl0Kukl93PZbYS,71.0,"alternative rock, britpop, madchester, modern rock, permanent wave, pop rock, rock"
I Prevail,3Uobr6LgQpBbk6k4QGAb3V,71.0,nu-metalcore
Tech N9ne,6UBA15slIuadJ8h2lPRPos,71.0,"hip hop, kansas city hip hop, pop rap"
Old Dominion,6y8XlgIV8BLlIg1tT1R10i,71.0,"contemporary country, country, country road"
IGGY AZALEA,5yG7ZAZafVaAlMTeBybKAL,71.0,"australian hip hop, dance pop, hip pop, pop, pop rap, post-teen pop, rap, viral rap"
A Day To Remember,4NiJW4q9ichVqL1aUsgGAN,71.0,"metalcore, pop punk, screamo"
Marilyn Manson,2VYQTNDsvvKN9wmU5W7xpj,71.0,"alternative metal, industrial, industrial metal, industrial rock, nu metal"
Queens of the Stone Age,4pejUc4iciQfgdX6OKulQn,71.0,"alternative metal, alternative rock, blues rock, modern rock, nu metal, palm desert scene, rock, stoner metal, stoner rock"
Tool,2yEwvVSSSUkcLeSTNyHKh8,71.0,"alternative metal, alternative rock, art rock, nu metal, progressive metal, progressive rock, rock"
Grimes,053q0ukIDRgzwTr4vNSwab,71.0,"art pop, canadian electropop, dance pop, grave wave, indietronica, metropopolis, pop"
Hollywood Undead,0CEFCo8288kQU7mJi25s6E,71.0,"alternative metal, modern rock, nu metal, pop rap, rap metal, rap rock"
Greta Van Fleet,4NpFxQe2UvRCAjto3JqlSl,71.0,"modern blues rock, modern hard rock, rock"
Crystal Castles,7K3zpFXBvPcvzhj7zlGJdO,70.0,"alternative dance, bitpop, digital hardcore, indietronica, neo-synthpop, new rave, nintendocore"
Lady Antebellum,32WkQRZEVKSzVAAYqukAEA,70.0,"contemporary country, country, country dawn, country pop, country road, neo mellow, pop"
Bakar,3K2Srho6NCF3o9MswGR76H,70.0,uk alternative hip hop
Incubus,3YcBF2ttyueytpXtEzn1Za,70.0,"alternative metal, alternative rock, funk metal, funk rock, nu metal, pop rock, post-grunge, rock"
The Who,67ea9eGLXYMsO2eYQRui3w,70.0,"album rock, art rock, blues rock, british invasion, classic rock, hard rock, mellow gold, psychedelic rock, rock"
Counting Crows,0vEsuISMWAKNctLlUAhSZC,70.0,"alternative rock, neo mellow, pop rock, rock"
Tinashe,0NIIxcxNHmOoyBx03SfTCD,70.0,"alternative r&b, dance pop, electropop, metropopolis, pop, pop r&b, post-teen pop, r&b, rap, urban contemporary"
Aminé,3Gm5F95VdRxW3mqCn8RPBJ,70.0,"hip hop, pop, portland hip hop, rap, viral rap"
Brett Young,0fiWOxhsBsQQvFDtxUQWo0,70.0,"contemporary country, country, country road"
Colbie Caillat,6aZyMrc4doVtZyKNilOmwu,70.0,"dance pop, neo mellow, pop, pop rock, post-teen pop, viral pop"
Seether,6B5c4sch27tWHAGdarpPaW,70.0,"alternative metal, nu metal, post-grunge, south african rock"
Kaleo,7jdFEYD2LTYjfwxOdlVjmc,70.0,"icelandic indie, icelandic rock, modern alternative rock"
Walk the Moon,6DIS6PRrLS3wbnZsf7vYic,70.0,"dance rock, indie poptimism, modern alternative rock, modern rock, pop rock, rock"
Fisher,1VJ0briNOlXRtJUAzoUJdt,70.0,"australian house, edm"
Years & Years,5vBSrE1xujD2FXYRarbAXc,70.0,"dance pop, edm, electropop, gauze pop, pop, pop dance, tropical house"
E-40,3crnzLy8R4lVwaigKEOz7V,70.0,"cali rap, gangster rap, hip hop, hyphy, oakland hip hop, pop rap, rap, southern hip hop, trap, west coast rap"
Lykke Li,6oBm8HB0yfrIc9IHbxs6in,70.0,"art pop, dance pop, electropop, pop, swedish electropop, swedish indie pop, swedish pop"
Chicago,3iDD7bnsjL9J4fO298r0L0,70.0,"adult standards, album rock, classic rock, folk rock, mellow gold, soft rock, yacht rock"
Earl Sweatshirt,3A5tHz1SfngyOZM2gItYKu,70.0,"alternative hip hop, experimental hip hop, hip hop, rap, underground hip hop"
Lady A,32WkQRZEVKSzVAAYqukAEA,70.0,"contemporary country, country, country dawn, country pop, country road, neo mellow, pop"
Caamp,0wyMPXGfOuQzNR54ujR9Ix,70.0,"indie folk, stomp and holler"
Lil Pump,3wyVrVrFCkukjdVIdirGVY,70.0,"emo rap, miami hip hop, rap, trap, vapor trap, viral rap"
TLC,0TImkz4nPqjegtVSMZnMRq,70.0,"atl hip hop, contemporary r&b, dance pop, girl group, hip hop, hip pop, r&b, urban contemporary"
John Newman,34v5MVKeQnIo0CWYMbbrPf,70.0,dance pop
Air,4xXCRXOfQKQ2gjWxNhNzYW,70.0,"mellow gold, soft rock"
Simple Plan,2p4FqHnazRucYQHyDCdBrJ,70.0,"canadian pop punk, canadian punk, canadian rock, pop punk"
Two Door Cinema Club,536BYVgOnRky0xjsPT96zl,70.0,"indietronica, irish rock, modern rock, northern irish indie, rock"
Godsmack,6gZq1Q6bdOxsUPUG1TaFbF,70.0,"alternative metal, nu metal, post-grunge, rap metal"
BROCKHAMPTON,1Bl6wpkWCQ4KVgnASpvzzA,70.0,"boy band, hip hop, rap"
Kacey Musgraves,70kkdajctXSbqSMJbQO424,70.0,"country dawn, pop, texas country"
Brandi Carlile,2sG4zTOLvjKG1PSoOyf5Ej,70.0,"folk, lilith, modern folk rock, neo mellow, new americana"
Jaden,0xOeVMOz2fVg5BJY3N6akT,70.0,"hip hop, pop, rap"
Kaskade,6TQj5BFPooTa08A7pk8AQ1,70.0,"edm, electro house, house, pop dance, progressive house, tropical house, vocal house"
Toby Keith,2bA6fzP0lMAQ4kz6CF61w8,70.0,"contemporary country, country, country road, oklahoma country"
UB40,69MEO1AADKg1IZrq2XLzo5,70.0,"reggae fusion, uk reggae"
Kenny Loggins,3Y3xIwWyq5wnNHPp5gPjOW,69.0,"album rock, mellow gold, new wave pop, soft rock, yacht rock"
Martin Jensen,4ehtJnVumNf6xzSCDk8aLB,69.0,"dance pop, danish electronic, edm, electro house, pop, pop dance, pop edm, tropical house"
America,35U9lQaRWSQISxQAB94Meo,69.0,"album rock, art rock, classic rock, country rock, folk rock, mellow gold, rock, soft rock"
Chris Young,4BYxqVkZyFjtik7crYLg5Q,69.0,"contemporary country, country, country road, modern country rock"
Rob Zombie,3HVdAiMNjYrQIKlOGxoGh5,69.0,"alternative metal, hard rock, industrial rock, nu metal, rap rock, rock"
Erykah Badu,7IfculRW2WXyzNQ8djX8WX,69.0,"afrofuturism, alternative r&b, hip hop, neo soul, r&b, urban contemporary"
James Taylor,0vn7UBvSQECKJm2817Yf1P,69.0,"adult standards, classic rock, folk, folk rock, mellow gold, rock, singer-songwriter, soft rock"
Snow Patrol,3rIZMv9rysU7JkLzEaC5Jp,69.0,"irish rock, neo mellow, permanent wave, pop rock"
Stevie Nicks,7crPfGd2k81ekOoSqQKWWz,69.0,"album rock, heartland rock, mellow gold, rock, soft rock"
Duran Duran,0lZoBs4Pzo7R89JM9lxwoT,69.0,"dance rock, new romantic, new wave, new wave pop, pop rock, rock, synthpop"
Alanis Morissette,6ogn9necmbUdCppmNnGOdi,69.0,"canadian pop, canadian singer-songwriter, pop rock, singer-songwriter"
The National,2cCUtGK9sDU2EoElnk0GNB,69.0,"indie rock, modern rock, stomp and holler"
Benee,0Cp8WN4V8Tu4QJQwCN5Md4,69.0,"alt z, nz pop, pop"
Sofi Tukker,586uxXMyD5ObPuzjtrzO1Q,69.0,"edm, pop"
Her,1Q6SZxTvaE3HhslV0iXbI6,69.0,"corrido, corridos tumbados, nueva musica mexicana, sad sierreno, sierreno"
Doobie Brothers,39T6qqI0jDtSWWioX8eGJz,69.0,"album rock, art rock, blues rock, classic rock, country rock, folk rock, hard rock, heartland rock, mellow gold, rock, soft rock, yacht rock"
The Kooks,1GLtl8uqKmnyCWxHmw9tL4,69.0,"brighton indie, modern rock, rock"
Soundgarden,5xUf6j4upBrXZPg6AI4MRK,69.0,"alternative metal, alternative rock, classic rock, grunge, hard rock, nu metal, rock"
Neil Diamond,7mEIug7XUlQHikrFxjTWes,69.0,"adult standards, brill building pop, classic rock, folk rock, mellow gold, singer-songwriter, soft rock, yacht rock"
Don Diablo,1l2ekx5skC4gJH8djERwh1,69.0,"dance pop, edm, electro house, future house, house, pop dance, progressive electro house, progressive house, tropical house"
Keyshia Cole,1vfezMIyCr4XUdYRaKIKi3,69.0,"contemporary r&b, dance pop, hip pop, neo soul, pop r&b, r&b, rap, urban contemporary"
Jimmy Eat World,3Ayl7mCk0nScecqOzvNp6s,69.0,"alternative rock, emo, modern power pop, modern rock, neo mellow, pop punk, pop rock, rock"
100 Gecs,6PfSUFtkMVoDkx4MQkzOi3,69.0,"hyperpop, proto-hyperpop, scenecore"
Oh Wonder,5cIc3SBFuBLVxJz58W2tU9,69.0,electropop
Phantogram,1l9d7B8W0IHy3LqWsxP2SH,69.0,"chillwave, indietronica, metropopolis, modern rock"
Slayer,1IQ2e1buppatiN1bxUVkrk,69.0,"alternative metal, death metal, hard rock, metal, nu metal, old school thrash, rock, speed metal, thrash metal"
Jamiroquai,6J7biCazzYhU3gM9j1wfid,69.0,dance pop
James Blake,53KwLdlmrlCelAZMaLVZqU,69.0,"indie soul, uk alternative pop"
Bob Sinclar,5YFS41yoX0YuFY39fq21oN,69.0,"dance pop, disco house, edm, electro house, filter house, vocal house"
BØRNS,1KP6TWI40m7p3QBTU6u2xo,69.0,"modern rock, pop"
Cypress Hill,4P0dddbxPil35MNN9G2MEX,69.0,"chicano rap, gangster rap, hardcore hip hop, hip hop, rap, rap rock, west coast rap"
In Flames,57ylwQTnFnIhJh4nu4rxCs,69.0,"alternative metal, gothenburg metal, melodic death metal, metal, nu metal, swedish death metal, swedish melodeath, swedish metal"
A Tribe Called Quest,09hVIj6vWgoCDtT03h8ZCa,69.0,"alternative hip hop, conscious hip hop, east coast hip hop, gangster rap, golden age hip hop, hardcore hip hop, hip hop, jazz rap, queens hip hop, rap"
Thirty Seconds to Mars,0RqtSIYZmd4fiBKVFqyIqD,69.0,"modern rock, post-grunge, rock"
Hardwell,6BrvowZBreEkXzJQMpL174,69.0,"big room, dance pop, dutch house, edm, electro house, pop dance, progressive electro house, progressive house, tropical house"
Rudimental,4WN5naL3ofxrVBgFpguzKo,69.0,"dance pop, edm, house, pop, pop dance, tropical house, uk dance, uk funky"
De La Soul,1Z8ODXyhEBi3WynYw0Rya6,69.0,"alternative hip hop, east coast hip hop, gangster rap, golden age hip hop, hardcore hip hop, hip hop, jazz rap, rap"
Judas Priest,2tRsMl4eGxwoNabM08Dm4I,69.0,"album rock, birmingham metal, classic rock, hard rock, metal, power metal, rock"
Vince Staples,68kEuyFKyqrdQQLLsmiatm,69.0,"conscious hip hop, hip hop, rap, underground hip hop"
Bone Thugs-n-Harmony,5spEJXLwD1sKUdC2bnOHPg,69.0,"gangster rap, hip hop, ohio hip hop, pop rap, rap, southern hip hop"
Kool & The Gang,3VNITwohbvU5Wuy5PC6dsI,69.0,"disco, funk, quiet storm, soul"
No Doubt,0cQbJU1aAzvbEmTuljWLlF,69.0,"alternative rock, dance pop, dance rock, permanent wave, pop rock"
Of Monsters and Men,4dwdTW1Lfiq0cM8nBAqIIz,69.0,"folk-pop, metropopolis, modern rock, pop rock, stomp and holler"
Matchbox Twenty,3Ngh2zDBRPEriyxQDAMKd1,69.0,"neo mellow, pop rock, post-grunge"
Fat Joe,3ScY9CQxNLQei8Umvpx5g6,69.0,"bronx hip hop, dance pop, east coast hip hop, gangster rap, hardcore hip hop, hip hop, hip pop, pop rap, rap, trap"
Bullet For My Valentine,7iWiAD5LLKyiox2grgfmUT,69.0,"alternative metal, melodic metalcore, metalcore, nu metal, uk metalcore, welsh metal"
Stone Temple Pilots,2UazAtjfzqBF0Nho2awK4z,69.0,"alternative metal, alternative rock, grunge, hard rock, nu metal, pop rock, post-grunge, rock"
Steely Dan,6P7H3ai06vU1sGvdpBwDmE,69.0,"album rock, art rock, classic rock, country rock, folk rock, mellow gold, rock, soft rock, yacht rock"
Deep Purple,568ZhdwyaiCyOGJRtNYhWf,68.0,"album rock, blues rock, classic rock, hard rock, metal, psychedelic rock, rock"
The xx,3iOvXCl6edW5Um0fXEBRXy,68.0,"downtempo, dream pop, indietronica"
Mika,5MmVJVhhYKQ86izuGHzJYA,68.0,"dance pop, europop, pop"
The Temptations,3RwQ26hR2tJtA8F9p2n7jG,68.0,"classic soul, funk, memphis soul, motown, soul"
New Order,0yNLKJebCb8Aueb54LYya3,68.0,"art rock, dance rock, madchester, new romantic, new wave, new wave pop, permanent wave, pop rock, post-punk, rock, synthpop, uk post-punk"
slowthai,3r1XkJ7vCs8kHBSzGvPLdP,68.0,"hip hop, rap, uk alternative hip hop, uk hip hop, underground hip hop"
The Temper Trap,4W48hZAnAHVOC2c8WH8pcq,68.0,modern rock
Darius Rucker,7FY5V3XMwlNBPitEjXowHQ,68.0,"black americana, contemporary country, country, country road"
Nine Inch Nails,0X380XXQSNBYuleKzav5UO,68.0,"alternative metal, alternative rock, cyberpunk, electronic rock, industrial, industrial metal, industrial rock, nu metal, rock"
Sheryl Crow,4TKTii6gnOnUXQHyuo9JaD,68.0,"lilith, mellow gold, neo mellow, new wave pop, permanent wave, pop rock, rock"
Nothing But Thieves,1kDGbuxWknIKx4FlgWxiSp,68.0,"alternative pop rock, modern alternative rock, modern rock, rock"
Dillon Francis,5R3Hr2cnCCjt220Jmt2xLf,68.0,"brostep, dance pop, edm, electro house, electronic trap, electropop, house, moombahton, pop, pop dance, slap house, tropical house"
Pet Shop Boys,2ycnb8Er79LoH2AsR5ldjh,68.0,"art pop, dance rock, europop, new romantic, new wave, new wave pop, permanent wave, synthpop"
Tom Misch,1uiEZYehlNivdK3iQyAbye,68.0,"indie soul, jazz pop"
The Chicks,25IG9fa7cbdmCIy3OnuH57,68.0,"country, country dawn, pop"
Deorro,6VD4UEUPvtsemqD3mmTqCR,68.0,"dance pop, edm, electro house, melbourne bounce, melbourne bounce international, pop dance, progressive electro house, tropical house"
fun.,5nCi3BB41mBaMH9gfr6Su0,68.0,"baroque pop, metropopolis, modern rock, pop rock"
Janelle Monae,6ueGR6SWhUJfvEhqkvMsVs,68.0,"afrofuturism, alternative r&b, atl hip hop, electropop, escape room, neo soul, pop"
Kid Rock,7dOBabd5O4CvKrg4iriHTM,68.0,"alternative metal, nu metal"
Yung Lean,67lytN32YpUxiSeWlKfHJ3,68.0,"psychedelic hip hop, underground hip hop"
Ginuwine,7r8RF1tN2A4CiGEplkp1oP,68.0,"contemporary r&b, dance pop, hip hop, hip pop, neo soul, r&b, urban contemporary"
Benny Benassi,4Ws2otunReOa6BbwxxpCt6,68.0,"dance pop, edm, electro house, pop dance"
Fabolous,0YWxKQj2Go9CGHCp77UOyy,68.0,"dance pop, gangster rap, hardcore hip hop, hip hop, hip pop, pop rap, r&b, rap, trap, urban contemporary"
Franz Ferdinand,0XNa1vTidXlvJ2gHSsRi4A,68.0,"alternative rock, dance rock, indie rock, modern rock, rock, scottish rock"
Diana Ross,3MdG05syQeRYPPcClLaUGl,68.0,"adult standards, dance pop, disco, mellow gold, motown, quiet storm, soul"
Icona Pop,1VBflYyxBhnDc9uVib98rw,68.0,"candy pop, dance pop, edm, electropop, metropopolis, pop, pop dance, swedish electropop, swedish synthpop, tropical house"
Brantley Gilbert,5q8HGNo0BjLWaTAhRtbwxa,68.0,"contemporary country, country, country road, modern country rock"
Flo Milli,08PvCOlef4xdOr20jFSTPd,68.0,"dance pop, pop, r&b, rap, viral rap"
Capital Cities,4gwpcMTbLWtBUlOijbVpuu,68.0,"metropopolis, modern rock"
M.I.A.,0QJIPDAEDILuo8AIq3pMuU,68.0,"dance pop, indietronica, new rave"
The Blaze,1Dt1UKLtrJIW1xxRBejjos,68.0,new french touch
Mario,20s0P9QLxGqKuCsGwFsp7w,68.0,"dance pop, hip pop, pop, pop r&b, r&b, urban contemporary"
Hoobastank,2MqhkhX4npxDZ62ObR5ELO,68.0,"alternative metal, funk metal, nu metal, pop rock, post-grunge"
Cascada,0N0d3kjwdY2h7UVuTdJGfp,68.0,"bubblegum dance, dance pop, eurodance, europop, german techno, melbourne bounce international, pop rap"
Pi’Erre Bourne,3x3jSlhyv5CiCZDZlaTq0M,67.0,"melodic rap, rap, trap, vapor trap"
Billy Currington,1By9QBFnjZAoI83BZppHlt,67.0,"contemporary country, country, country road"
Yeah Yeah Yeahs,3TNt4aUIxgfy9aoaft5Jj2,67.0,"alternative dance, alternative rock, dance-punk, garage rock, indie rock, modern rock, new rave, rock"
Lamb of God,3JFsVIxOn7STeilPICkkB2,67.0,"alternative metal, groove metal, melodic metalcore, metal, nu metal, virginia metal"
D12,5Qi4Bb7a8C0a00NZcA77L0,67.0,"detroit hip hop, gangster rap, hip hop, pop rap, rap"
Young the Giant,4j56EQDQu5XnL7R3E9iFJT,67.0,"modern alternative rock, modern rock, rock, stomp and holler"
Tarkan,2yMN0IP20GOaN6q0p0zL5k,67.0,turkish pop
Crowded House,7ohlPA8dRBtCf92zaZCaaB,67.0,"australian rock, mellow gold, permanent wave, pop rock, rock, soft rock"
Yelawolf,68DWke2VjdDmA75aJX5C57,67.0,"alabama rap, hip hop, pop rap, rap, southern hip hop"
Jackson Wang,1kfWoWgCugPkyxQP8lkRlY,67.0,
Nightwish,2NPduAUeLVsfIauhRwuft1,67.0,"finnish metal, finnish power metal, gothic metal, gothic symphonic metal, opera metal, power metal, symphonic metal"
Kshmr,2wX6xSig4Rig5kZU6ePlWe,67.0,"big room, dance pop, edm, electro house, indian edm, pop dance, slap house, tropical house"
