artistName,artistID,artistPop,artistGenre
Eagles of Death Metal,02uYdhMhCgdB49hZlYRm9o,55.0,"alternative rock, blues rock, garage rock, garage rock revival, modern blues rock, modern rock, palm desert scene, punk blues, rock"
Totally Enormous Extinct Dinosaurs,0g3NiCRhEv7M4SEDMrpItN,55.0,"alternative dance, electronica, indietronica, new rave, nu disco, oxford indie"
Elbow,0TJB3EE2efClsYIDQ8V2Jk,55.0,"britpop, neo mellow, pop rock"
Paul Oakenfold,5MO2kbaGGA2a8kL4c9qqHq,55.0,"big beat, trance"
Black Rebel Motorcycle Club,1tpXaFf2F55E7kVJON4j4G,55.0,"alternative rock, blues rock, garage rock, garage rock revival, indie rock, modern alternative rock, modern blues rock, modern rock, permanent wave, punk blues, rock"
Dada Life,00sAT5YX8W3xNd1EuqyHw9,55.0,"big room, dance pop, edm, electro house, pop dance, progressive electro house, progressive house"
Mattn,1RQ3ZwCNI7KniEKIN5kkio,55.0,"belgian edm, edm, electro house, pop dance, sky room"
Steel Panther,3l02WF362j1oHOurzuseBv,55.0,"comic, comic metal, glam metal, hard rock, metal, rock, sleaze rock"
Roisin Murphy,3qwabfaWewpfli7hMNM3O8,55.0,"alternative dance, art pop, dance pop, electronica, electropop, neo-synthpop, new rave"
Kraftwerk,0dmPX6ovclgOy8WWJaFEUU,55.0,"dusseldorf electronic, early synthpop, electro, new romantic, new wave, proto-techno, synthpop"
Jinjer,7o6cOczXTB8ioTAAJTbESf,55.0,slayer
The Cat Empire,023YMawCG3OvACmRjWxLWC,55.0,"australian reggae fusion, australian ska, ska jazz"
Makj,3PtCud9dIdOv4exrzdZZ1C,55.0,"edm, electro house, melbourne bounce, pop dance, progressive electro house"
Astrix,3dUltShd2gJQc98Kc7Syit,55.0,"full on, nitzhonot, psychedelic trance"
Jason Isbell,3Q8wgwyVVv0z4UEh1HB0KY,55.0,"alternative country, folk, indie folk, new americana, roots rock, stomp and holler"
Bassnectar,1JPy5PsJtkhftfdr6saN2i,55.0,"bass music, breakbeat, brostep, edm, electro house, electronic trap, glitch hop"
Jamie Jones,4admDxmnri5Zco0xYrJ0ji,55.0,"deep disco house, deep house, house, minimal techno, tech house, uk tech house"
The Courteeners,1NfJU4hy56Z4UM4iyIa1B2,55.0,"britpop, manchester indie, modern rock, rock"
REEL BIG FISH,3bXhZFreBJF4QDUUiMmtZW,55.0,"modern ska punk, pop punk, punk, ska, ska punk, skate punk, socal pop punk"
Noname,1EpyA68dKpjf7jXmQL88Hy,55.0,"alternative r&b, chicago rap, escape room, indie soul, neo soul, rap, underground hip hop"
Billy Bragg,5yXAFDZNUNyO92l5WTImkO,55.0,"alternative country, anti-folk, folk, folk punk, folk rock, permanent wave, roots rock, singer-songwriter, uk americana"
Adventure Club,5CdJjUi9f0cVgo9nFuJrFa,55.0,"brostep, canadian electronic, edm, electro house, electronic trap, electropop, filthstep, future bass, melodic dubstep, pop dance, pop edm"
Suicidal Tendencies,3WPKDlucMsXH6FC1XaclZC,55.0,"alternative metal, california hardcore, crossover thrash, funk metal, hardcore punk, metal, nu metal, old school thrash, punk, rap rock, rock, thrash metal"
Tommy Trash,1tBU8jUEdVR3mqSsAqEGfD,54.0,"aussietronica, australian dance, edm, electro house, progressive electro house, progressive house"
Purity Ring,1TtJ8j22Roc24e2Jx3OcU4,54.0,"art pop, canadian electropop, chillwave, dark pop, dream pop, edmonton indie, electropop, grave wave, indietronica, metropopolis, shimmer pop"
Sublime with Rome,3XXrhkZKSGd3CUJQFnx5tQ,54.0,reggae rock
SBTRKT,1O10apSOoAPjOu6UhUNmeI,54.0,"alternative dance, electronica, future garage, indie soul, new rave, uk bass"
Of Montreal,5xeBMeW0YzWIXSVzAxhM8O,54.0,"alternative dance, alternative rock, anti-folk, art pop, baroque pop, elephant 6, indie pop, indie rock, new rave"
Pete Tong,6n1t55WMsSIUFHrAL4mUsB,54.0,disco house
The Breeders,1xgFexIwrf2QjbU0buCNnp,54.0,"alternative pop, alternative rock, anti-folk, boston rock, dream pop, indie rock, lo-fi, pop rock, post-punk"
Carl Cox,19SmlbABtI4bXz864MLqOS,54.0,"house, schranz, tech house, uk tech house"
Ferry Corsten,2ohlvFf9PBsDELdRstPtlP,54.0,"dutch trance, edm, pop dance, progressive house, progressive trance, trance, uplifting trance"
Zomboy,0ycHhPwPvoaO4VGzmMnXGq,54.0,"brostep, dubstep, edm, electro house, electronic trap, glitch"
Drive By Truckers,1rXr1ZnvbRoYBaedIl9v4v,54.0,"alternative country, country rock, deep new americana, new americana, roots rock, southern rock"
Zatox,27Z5l2Kfy1IaYZMg5INWqO,54.0,"classic hardstyle, euphoric hardstyle, rawstyle"
Dyro,03MVmfitJTVJIxYmObhQn9,54.0,"dutch edm, edm, electro house, pop dance, progressive electro house, progressive house"
Danny Avila,5y3G1B8cpCTaoq0uDgjwzH,54.0,pop dance
The Jesus and Mary Chain,4rjlerN21ygkIhmUv55irs,54.0,"alternative rock, art rock, new wave, noise pop, pop rock, post-punk, rock, scottish indie, shoegaze, uk post-punk"
Amyl & The Sniffers,3NqV2DJoAWsjl787bWaHW7,53.0,australian garage punk
Explosions In The Sky,1uQWmt1OhuHGRKmZ2ZcL6p,53.0,"american post-rock, cinematic post-rock, instrumental post-rock, melancholia, post-rock"
Maceo Plex,3TXQ1ddouwQAI78hV4hXDj,53.0,"deep disco house, electronica, house, latin tech house, melodic techno, microhouse, minimal tech house, minimal techno, tech house"
Shame,4IeWU3NYBI9mISFVhzXG8f,53.0,"chamber psych, crank wave, indie rock, modern alternative rock, modern rock, uk post-punk revival"
Katy B,5EUdiv20t58GCS09VMKk7M,53.0,"dance pop, hip house, uk funky"
Snail Mail,4QkSD9TRUnMtI8Fq1jXJJe,53.0,"art pop, baltimore indie, bubblegrunge, indie pop, indie rock"
Dinosaur Jr.,267VY6GX5LyU5c9M85ECZQ,53.0,"alternative pop, alternative rock, grunge, indie rock, lo-fi, noise pop, noise rock, permanent wave, post-hardcore, post-punk, power pop, punk, rock"
Me First and The Gimme Gimmes,0cOVRC8EOwDwXrs3JTrRN5,53.0,"comic, punk, ska, ska punk, skate punk"
Everything Everything,1HOeqtP7tHkKNJNLzQ2tnr,53.0,"alternative dance, experimental pop, indie rock, modern alternative rock, modern rock, new rave"
Superorganism,0Wkm45quqfx3NepJpXDvwE,53.0,art pop
Tale of Us,1UL813H5aj3e8ekE5RqWqc,53.0,"deep disco house, italian techno, melodic techno, minimal tech house"
Bombs Away,1YlyxjwYNSjBD0NAJGEfWB,53.0,"australian dance, melbourne bounce international"
Guided By Voices,4oV5EVJ0XFWsJKoOvdRPvl,53.0,"alternative pop, alternative rock, anti-folk, art rock, dayton indie, dream pop, gbvfi, indie rock, lo-fi, modern power pop, noise pop, ohio indie, power pop"
Yellow Days,3dv4Q4q3LWOnbLJnC6GgTY,53.0,bedroom pop
Carta,3MTk6MUbUmV5X0N04N56JF,53.0,"big room, edm, electro house"
The Replacements,4WPY0N74T3KUja57xMQTZ3,53.0,"alternative pop, alternative rock, anti-folk, indie rock, new wave, permanent wave, pop rock, post-punk, power pop, punk, roots rock"
Goldfrapp,5BKsn7SCN2XmbF7apdCpRS,53.0,"alternative dance, art pop, big beat, chamber psych, dance pop, electronica, electropop, neo-synthpop, new rave, trip hop"
The Voidz,4nUBBtLtzqZGpdiynTJbYJ,52.0,modern alternative rock
Real Estate,41SQP16hv1TioVYqdckmxT,52.0,"chillwave, dreamo, indie pop, indie rock, lo-fi, modern rock, new jersey indie, noise pop"
The California Honeydrops,21t0aavYGSGFkYYFhu6urk,52.0,"bay area indie, deep new americana, funk, modern funk"
Slash feat. Myles Kennedy,1J0FSEQhWSMHcYqaapIjY6,52.0,
Sander Van Doorn,22bukBZvUppuwQwmDz75Gz,52.0,"dutch trance, edm, electro house, house, pop dance, progressive electro house, progressive house, trance"
Borgore,7u160I5qtBYZTQMLEIJmyz,52.0,"brostep, classic dubstep, dubstep, edm, electro house, electronic trap, filthstep"
Broken Social Scene,7lOJ7WXyopaxri0dbOiZkd,52.0,"alternative dance, alternative rock, baroque pop, canadian indie, canadian rock, chillwave, indie pop, indie rock, modern rock, noise pop, stomp and holler"
Built To Spill,3kbBWco9PZ5eSQsNScwG6U,52.0,"alternative rock, anti-folk, idaho indie, indie rock, lo-fi, modern rock"
The Kills,5BYuBzqmTXwUDw2rYkwExr,52.0,"alternative dance, alternative rock, dance-punk, garage rock, garage rock revival, indie rock, modern blues rock, modern rock, new rave, rock"
Refused,5sdxGvwxI1TkTA6Pu2jnTb,52.0,"hardcore punk, post-hardcore, swedish hardcore, swedish post-hardcore, umea hardcore, vegan straight edge"
The Ting Tings,2wvUfjKGoXvcnDHq7GgMOa,52.0,"alternative dance, dance pop, dance-punk, electropop, new rave"
Conspirator,1J0FSEQhWSMHcYqaapIjY6,52.0,
Animal Collective,4kwxTgCKMipBKhSnEstNKj,52.0,"alternative dance, alternative rock, art pop, baltimore indie, chillwave, dream pop, experimental pop, freak folk, indie rock, modern rock, new rave, noise pop"
Arkells,3ShGiAyhxI6Rq3TknZ3gfk,52.0,"canadian indie, canadian rock, hamilton on indie"
Dawes,0CDUUM6KNRvgBFYIbWxJwV,52.0,"alternative country, deep new americana, indie folk, indie rock, modern folk rock, new americana, pop rock, roots rock, stomp and holler"
Thee Oh Sees,3qYfqdVwX0fil71onLpLkh,52.0,"alternative rock, australian garage punk, bay area indie, crank wave, double drumming, garage pop, garage rock, indie garage rock, indie rock, neo-psychedelic, noise pop, psychedelic punk, punk blues"
Deerhunter,38zTZcuN7nFvVJ6auhc6V3,52.0,"alternative dance, alternative rock, art pop, atlanta indie, chillwave, dream pop, experimental rock, indie rock, lo-fi, modern rock, neo-psychedelic, new rave, noise pop, noise rock, shoegaze"
Amelie Lens,5Ho1vKl1Uz8bJlk4vbmvmf,52.0,"acid techno, belgian techno, dark techno, electra"
Floating Points,2AR42Ur9PcchQDtEdwkv4L,52.0,"electronica, microhouse, uk bass, wonky"
RJD2,1O3ZOjqFLEnbpZexcRjocn,52.0,"alternative hip hop, big beat, electronica, jazztronica, nu jazz, turntablism"
Waxahatchee,5IWCU0V9evBlW4gIeGY4zF,52.0,"alabama indie, art pop, bubblegrunge, chamber pop, indie folk, indie pop, indie rock, new americana"
Lotus,0HM4KuHUJ5ww5DdOGi3FEf,52.0,japanese vgm
Ibeyi,5Q8NEHGX70m1kkojbtm8wa,52.0,"cuban alternative, etherpop"
Mogwai,34UhPkLbtFKRq3nmfFgejG,52.0,"british post-rock, cosmic post-rock, indie rock, post-rock"
Honey Dijon,0XfQBWgzisaS9ltDV9bXAS,52.0,"deep house, vocal house"
Green Velvet,3ABaec4jjl95VqmG1iD4k2,52.0,"bass house, house, minimal techno, tech house, techno"
Mark Sixma,3ePCIHipMKD4n8IBXBYWSm,52.0,"dutch trance, edm, pop dance, progressive house, progressive trance, trance, uplifting trance"
Mariana Bo,2cFzYhiHqYS7o8ZIM9WD22,52.0,mexican edm
Parquet Courts,23NIwARd4vPbxt3wwNnJ6k,52.0,"alternative rock, brooklyn indie, crank wave, denton tx indie, indie garage rock, indie rock, modern rock, neo-psychedelic, noise pop"
Widespread Panic,54SHZF2YS3W87xuJKSvOVf,51.0,"athens indie, jam band, roots rock, southern rock"
Warpaint,3AmgGrYHXqgbmZ2yKoIVzO,51.0,"alternative dance, art pop, chamber psych, chillwave, dream pop, electronica, indie rock, la indie, modern alternative rock, modern dream pop, modern rock, new rave"
Crystal Fighters,75EZuo5MHV2572NRpMWotC,51.0,"alternative dance, new rave"
Cut Copy,4EENT7N7rCBwrddM3s0vFS,51.0,"alternative dance, australian dance, australian electropop, chillwave, dance-punk, electronic rock, electronica, electropop, filter house, indie rock, indietronica, modern rock, neo-synthpop, new rave, nu disco"
Black Midi,7Hvq85OU8T7Hsd63zNBwaL,51.0,"crank wave, indie rock, noise rock, uk noise rock, uk post-punk revival"
The Crystal Method,5eKLa1xyHLq8ERWmT1CRHj,51.0,"big beat, breakbeat, electronica"
Adam Beyer,1btv9qmIpbp7q1ixCYNdHu,51.0,"dark techno, minimal techno, raw techno, schranz, swedish electronic, swedish techno, techno"
Pond,4skJp5OKvcc9eKokiuhi2s,51.0,"indie rock, neo-psychedelic"
Zeal & Ardor,6yCjbLFZ9qAnWfsy9ujm5Y,51.0,"avant-garde metal, swiss metal"
Blitzen Trapper,72XY3HrDdFfZXNZFCT9Zh1,51.0,"deep new americana, indie folk, modern folk rock, new americana, portland indie, roots rock, stomp and holler"
Pretty Lights,4iVhFmG8YCCEHANGeUUS9q,51.0,"glitch hop, jazztronica, livetronica"
Chelsea Wolfe,6ZK2nrW8aCTg8Bid7I7N10,51.0,"dark pop, doomgaze, gaian doom, sacramento indie"
Markus Schulz,6OO0PboZcIWUWL7j2IyeoL,51.0,"edm, progressive house, progressive trance, trance, uplifting trance"
Girl Talk,6awzBEyEEwWHOjLox1DkLr,51.0,"mashup, pittsburgh indie"
Giuseppe Ottaviani,5B9q1NRokzWYB7nSgnlHyv,51.0,"italian trance, progressive house, progressive trance, trance, uplifting trance"
People Under the Stairs,0av074qUwLn5eyzwqoq3xh,51.0,"alternative hip hop, hip hop, jazz rap"
Frank Carter & The Rattlesnakes,3r32a6mMdoPaSP1C7kYhMc,51.0,"modern alternative rock, modern rock"
Calexico,1OmdWpAh1pucAuZPzJaxIJ,50.0,"alternative country, roots rock, tucson indie"
Oxia,2zgFYHwSEYOc1KnldGsBXK,50.0,"french tech house, minimal techno, tech house"
Erick Morillo,4DE0cYxMnEEmfKLwDkYwxb,50.0,"disco house, tech house, tribal house, vocal house"
Greensky Bluegrass,33bzrYoIWLx5uox3y0VtHn,50.0,"banjo, bluegrass, jam band, jamgrass, midwest americana, new americana, progressive bluegrass"
Django Django,2ARO60gI5do88ho6azmzab,50.0,"alternative dance, chamber psych, electronic rock, indie rock, modern rock, new rave, shimmer pop"
Polica,34vLhockmYhf3LgznwyNaQ,50.0,"art pop, chillwave, electropop, metropopolis, shimmer pop"
Shadow,76xrrejizyQpKukBIhnf3D,50.0,"melodic deathcore, slamming deathcore, symphonic deathcore"
Sidney Samson,3XonXgjEAAXVl0WKLF1Z4g,50.0,"dutch house, electro house"
Big Freedia,2gyv1akuIB9fQvXoGSPaJr,50.0,"bounce, escape room, lgbtq+ hip hop, new orleans rap, trap queen"
The Black Angels,0VNWuGf8SMVU2AerpdhMbP,50.0,"blues rock, chamber psych, garage rock, neo-psychedelic, punk blues"
Jerome Isma Ae,4GEIawzVZxWGdtl9OOdgeA,50.0,"munich electronic, progressive house, progressive trance, trance, uplifting trance"
Ross From Friends,1Ma3pJzPIrAyYPNRkp3SUF,50.0,"deep house, electronica, float house, lo-fi house"
John Maus,4R073T3AVJKqAsbzLmLW9u,50.0,"art pop, baroque pop, chillwave, experimental pop"
Aly & Fila,2hL1EouqXLtBEB6JKnPF0h,50.0,"progressive house, progressive trance, trance, uplifting trance"
Ty Segall,58XGUNsRNu3cVOIOYk5chx,50.0,"alternative rock, australian garage punk, bay area indie, garage pop, garage rock, indie garage rock, indie rock, neo-psychedelic, noise pop, oc indie, punk blues"
Dannic,1PFc84GHTYPL0G12JHh9Mc,49.0,"dutch edm, edm, electro house, pop dance, pop edm, progressive electro house, progressive house, sky room"
Little Louie Vega,5dncbrnveDMX9DgxcedeUg,49.0,"afro house, chicago house, classic house, deep house, disco house, latin house, soulful house, vocal house"
Skream,2jbP92oFLWqPqogflK1wlW,49.0,"classic dubstep, uk bass"
Liquid Stranger,4YJsSCuag8W1TFTgSeEc2k,49.0,"brostep, downtempo, drill and bass, edm, electro house, electronic trap"
Slaves,0QF3SelvOph6yRhKH8jRxU,49.0,
Chicano Batman,0LklyUMMUhpIjMgYHlV0hN,49.0,"indie garage rock, la indie, latinx alternative, psychedelic soul, tropical alternativo"
Com Truise,2wouN3QXejYa5tKetYdcVX,49.0,"chillwave, indietronica, vaporwave"
Modestep,5zYJziKktyqWwmoAWXrShP,49.0,"brostep, dubstep, edm, electro house"
Wolfpack,74ycentHh1YZrW5x4PLnox,49.0,"belgian edm, big room, crust punk, electro house"
Neon Indian,0KydPQPUUoTNhmiHKOg5Er,49.0,"alternative dance, chillwave, denton tx indie, experimental pop, indie rock, indietronica, neo-synthpop, new rave"
The Bloody Beetroots,0QJKELJZZuLAjqLOOixJm5,49.0,"alternative dance, dance-punk, electro house, fidget house, filter house, new rave"
Henri Pfr,6n9XmMc3mX18mrTHYOCPIq,49.0,"belgian edm, belgian pop, new french touch"
Trombone Shorty & Orleans Avenue,37ZvFp654tY74Z1D2TLOGR,49.0,"funk, jazz trombone, modern funk, new orleans funk"
Lettuce,1fZXjUQEkVbB0TvZX4qFR8,49.0,"funk, funk rock, instrumental funk, jam band, modern funk"
Trombone Shorty,37ZvFp654tY74Z1D2TLOGR,49.0,"funk, jazz trombone, modern funk, new orleans funk"
Dirty South,1bpzpALZwOoKXzwMg2i8WB,49.0,"australian dance, edm, electro house, pop dance, progressive electro house, progressive house"
Deer Tick,3rT8xTwSOMDURtWpPyoKIO,48.0,"alternative country, deep new americana, indie folk, indie rock, modern folk rock, new americana, rhode island indie, roots rock, stomp and holler"
Flosstradamus,2FmzVitXZjIkFolH8HXd4j,48.0,"bass trap, edm, electro house, electronic trap, mashup"
Felix Da Housecat,4rC8J4M4aOqsQSCP4yoyJI,48.0,"acid house, alternative dance, chicago house, electroclash, electronica, filter house, new rave, tech house"
Dirtyphonics,4zymhxzJ0UJc74tMHGyoWs,48.0,"drum and bass, dubstep, edm, electro house, french dnb, gaming dubstep, jump up"
Gov't Mule,5zoKOcTDI9EMOhGNaxL708,48.0,"blues rock, classic rock, country rock, electric blues, jam band, modern blues, modern blues rock, rock, southern rock"
Ra Ra Riot,6FIrstf3kHEg3zBOyLpvxD,48.0,"baroque pop, indie pop, indie poptimism, indie rock, indietronica, modern rock, piano rock, shimmer pop, stomp and holler"
Charlotte Gainsbourg,2rBcvLKWCZs9w1qIWv560v,48.0,"alternative dance, art pop, chamber psych, electronica"
The Polish Ambassador,2dI9IuajQnLR5dLxHjTTqU,48.0,electropop
Guy Gerber,3bqBkAzdPwEDe1JUvb7ZeC,48.0,"deep disco house, israeli techno, microhouse, minimal techno, organic electronic, organic house, tech house"
The Walkmen,6kFay2DQ5aZfeu5OsrF3Pw,48.0,"alternative rock, chamber pop, indie rock, modern rock, noise pop, stomp and holler"
Tennyson,3Nb8N20WChM0swo5qWTvm8,48.0,"edmonton indie, future bass, vapor soul, vapor twitch"
Eats Everything,4W991QdgKWX4TO864ypInA,48.0,"deep disco house, house, raw techno"
At The Drive-In,5E2rtn57BM2WPjwak4kGd5,48.0,"alternative metal, alternative rock, el paso indie, emo, indie rock, modern rock, post-hardcore"
Swans,79S80ZWgVhIPMCHuvl6SkA,48.0,"alternative rock, art pop, art rock, dream pop, experimental, experimental rock, indie rock, industrial, industrial rock, no wave, noise rock, post-punk, post-rock"
Tank and the Bangas,5cAtakaadWHJLxmGKrKcX7,48.0,"alternative r&b, indie soul, new orleans funk"
Umek,5Hini2nQyoglzpdKe41cZt,48.0,"dark techno, minimal techno, raw techno, slovenian electronic, tech house"
Paris Texas,1SCrMreNPJYSRZIlRe9SUq,48.0,"indie hip hop, indie r&b"
Ezra Furman,1uR7zoLrSRI8bSL43OZ0GY,48.0,"alternative pop, transpop"
Marc Rebillet,72udTJKu1pGovvS9aCYGMI,48.0,
Elephant Revival,3OwOKwd5FsfOD5qlH2tnzs,48.0,"deep new americana, indie folk, laboratorio, new americana, progressive bluegrass, stomp and holler, washboard"
Sleigh Bells,59pWgeY26Q6yJy37QvJflh,48.0,"alternative dance, art pop, brooklyn indie, chillwave, electropop, escape room, experimental pop, indie rock, indie surf, indietronica, modern rock, new rave, noise pop"
Big Head Todd and the Monsters,1lOQRP0UJWmpoDWBa8PB0B,48.0,"jam band, mellow gold, pop rock"
Electric Wizard,4htjQW3lgIwL6fEJlTOez4,48.0,"doom metal, post-doom metal, psychedelic doom, sludge metal, stoner metal, stoner rock, uk doom metal"
MUTEMATH,1J9Z9bhqkgyqseEi85cbyx,48.0,alternative rock
Miss Kittin,3QhNv79NoIvarU6N57GBzL,47.0,"alternative dance, electra, electroclash, electronica, french techno, new rave"
Best Coast,5YkBrE0wF8cAlq3GCOw5Eu,47.0,"indie pop, indie rock, indie surf, la indie, metropopolis"
Shpongle,0m5XJwKGYyUjd3VMfcINCQ,47.0,"downtempo, livetronica, new tribe, psychedelic trance, psychill"
Twiddle,0hNjIdUHXWhd0dilzi6c12,47.0,"funk rock, jam band"
Jenny Lewis,5cMVRrisBpDkXCVG48epED,47.0,indie pop
Nina Kraviz,1oZmFNkGAT93yD1xX4vTRE,47.0,"electra, russian electronic, russian techno"
Kate Tempest,1YcprGtF13BYCZQK9jYPEw,47.0,"alternative r&b, crank wave, lgbtq+ hip hop, slam poetry"
Mudhoney,7LuYiSXiWs86rwWJjEEgB9,47.0,"alternative metal, alternative rock, grunge, punk, rock"
Rolling Blackouts Coastal Fever,65mMkD9WW39U9Yadv0dWUF,47.0,"australian garage punk, australian indie, indie rock, modern jangle pop, modern rock"
Body Count,5KCph1z3jaSwhtwPzoYp6i,47.0,"alternative metal, funk metal, nu metal, political hip hop, rap metal, rap rock"
Wavves,6bUJpbekaIlq2fT5FMV2mQ,47.0,"indie garage rock, indie rock, indie surf, lo-fi, noise pop, noise rock, nu gaze, san diego indie, surf punk"
Lush,3ysp8GwsheDcBxP9q65lBg,47.0,"alternative pop, alternative rock, britpop, dream pop, shoegaze"
Tokyo Police Club,3wyfo3svXNWnszGAEVey11,47.0,"canadian indie, indie rock, modern rock, ontario indie"
Ride,0WPY9nnBy01s5QOt4o4oQX,47.0,"alternative rock, britpop, dream pop, dreamo, new wave, noise pop, oxford indie, shoegaze"
Datsik,48q2mPVwlKnlSaCx07i6Ta,46.0,"breakbeat, brostep, canadian electronic, edm, electro house, electronic trap, filthstep"
Heartless Bastards,2wwMTLM2da1sa2JcJslf8W,46.0,"new americana, stomp and holler"
Gogol Bordello,2SVw939fwuqSobLjF8u78b,46.0,gypsy punk
Prophets of Rage,1fSzW5cXBmquli5laFnoGY,46.0,"alternative metal, conscious hip hop, political hip hop, rap metal, rap rock, supergroup"
The Horrors,7EFB09NxZrMi9pGlOnuBpd,46.0,"alternative dance, chamber psych, deep gothic post-punk, dream pop, electronica, essex indie, garage rock, grave wave, indie rock, modern rock, new rave, nu gaze, shoegaze"
Deafheaven,4XpPveeg7RuYS3CgLo75t9,46.0,"atmospheric black metal, blackened screamo, blackgaze, dreamo, post-metal, usbm"
Gold Panda,6xS3zemJD9h94iueQvGqVk,46.0,"chillwave, electronica, future garage, indietronica, microhouse, uk bass, wonky"
Umphrey's McGee,7mQilAy42MqNPqUFqK4Z0o,46.0,jam band
Yonder Mountain String Band,1ReHC2jB2DGoPbMYhzuFuO,46.0,"banjo, bluegrass, jam band, jamgrass, progressive bluegrass, string band"
Godspeed You! Black Emperor,4svpOyfmQKuWpHLjgy4cdK,46.0,"canadian post-rock, double drumming, indie rock, instrumental post-rock, post-rock"
Galactic,4rMUtWPGbE6waga7PQO0oQ,46.0,"funk, funk rock, jam band, modern funk, new orleans funk"
Foxygen,55LHFEtIplWhsfyWZUwkf4,46.0,"baroque pop, experimental pop, indie garage rock, indie rock, neo-psychedelic"
Red Fang,3u4HBuoQ4dgPBzX2Q9uf5S,46.0,"alternative metal, doom metal, portland metal, psychedelic doom, sludge metal, stoner metal, stoner rock"
King Diamond,5i0ph60TnwTlIGrOZAmcZa,46.0,"danish metal, death metal, hard rock, metal, power metal, thrash metal"
The Black Lips,35C0NSLogAwImm8HAMqEmG,46.0,"atlanta indie, atlanta punk, australian garage punk, garage pop, garage rock, indie garage rock, indie rock, neo-psychedelic, punk blues"
Teenage Fanclub,2Sp19cOHSqAUlE64hekARW,45.0,"alternative pop, alternative rock, dream pop, jangle pop, modern power pop, pop rock, power pop, scottish indie, shoegaze"
Dr. Kucho!,263Gr9lGWR6ScnRGjxa3Ad,45.0,
Hurray for the Riff Raff,2xLEV2jDreAOcpJXFNoXyt,45.0,"alternative country, folk, indie pop, new americana, new orleans americana, queer country, stomp and holler"
The Comet is Coming,0Z5FMozvx15nUSUA6a9kkU,45.0,"british jazz, chamber psych, indie jazz, uk contemporary jazz"
Baroness,3KdXhEwbqFHfNfSk7L9E87,45.0,"alternative metal, post-doom metal, progressive sludge, sludge metal"
Yeasayer,04HvbIwBccFmRie5ATX4ft,45.0,"alternative dance, art pop, brooklyn indie, chillwave, dream pop, indie rock, modern rock, new rave, shimmer pop"
Leftover Salmon,2dU9NlAClSjQtKoVgUQwdz,45.0,"bluegrass, jam band, jamgrass, progressive bluegrass, roots rock"
Converge,7kHzfxMLtVHHb523s43rY1,45.0,"boston hardcore, chaotic hardcore, mathcore, melodic hardcore, metalcore, post-doom metal, post-hardcore, sludge metal"
Pussy Riot,2hThsqaVEAWhWPBXnaOfB9,45.0,"escape room, riot grrrl, russian indie, russian punk"
Swanky Tunes,06cLuOP0p7VAnBnqil1eWX,45.0,"edm, electro house, pop dance, pop edm, progressive electro house, progressive house, russian edm, sky room"
Chuckie,4x7gxsrTH3gThvSKZPPwaQ,44.0,"dutch house, edm, electro house, melbourne bounce, pop dance, progressive electro house"
The String Cheese Incident,7N3JfLDzzjXdPbsyco7X0l,44.0,"jam band, jamgrass, progressive bluegrass"
The Bronx,7nqSDaZKccpnUqjzedyZF4,44.0,"melodic hardcore, skate punk"
Trey Anastasio,3Felk6Y6jjU00yE1XTOqKZ,44.0,jam band
Project 46,2RhRT6DNOVoDTfS0rG31pZ,44.0,"edm, electro house, gaming edm, pop edm, progressive electro house"
The Del McCoury Band,2fj5pzLyOKDpUOPZs9q3wt,44.0,"bluegrass, jam band, old-time, progressive bluegrass"
Anders Osborne,3WUUtA45g7X0jbeywZz888,44.0,"country rock, deep new americana, funk, indie folk, jam band, louisiana blues, modern blues, modern blues rock, new americana, new orleans blues, roots rock"
Dub Fx,4ucW1LE5T7y7X4jlaKCeVo,44.0,beatboxing
San Fermin,7fSnislKgW9Mz0YIqWQmGt,44.0,"brooklyn indie, chamber pop, stomp and holler"
Simian Mobile Disco,31DXlldabwPHwu6dYevuzK,44.0,"alternative dance, big beat, electroclash, electronica, filter house, indietronica, new rave"
Rave Republic,751qvO4d3fNm3WkLvOS5Wa,44.0,"big room, deep big room, singaporean electronic, singaporean pop"
The Hold Steady,3qkZBMz5JgmRN9u5wwhRC6,44.0,"alternative country, alternative rock, heartland rock, indie rock, pop rock, roots rock"
Andy Moor,0Fn4agIyGMwQsKHrx1i8Dn,44.0,"progressive house, progressive trance, trance, uplifting trance"
Paris Jackson,11I8qWK4foqycuPFRDFH6e,43.0,
Ellen Allien,5lsC3H1vh9YSRQckyGv0Up,43.0,"electra, electronica, german techno, microhouse, minimal techno"
Juicy M,6klooWKc13AOY1BVfE0Tm6,43.0,"sky room, ukrainian edm, ukrainian electronic"
Jawbreaker,4bcaz6nXnH8LTRiXALe8XV,43.0,"alternative emo, alternative rock, emo, emo punk, indie punk, indie rock, melodic hardcore, orgcore, post-hardcore, punk, skate punk"
Basto!,2BJTwV4IpFe2gWL46KKlji,43.0,"belgian edm, edm, electro house, pop dance, progressive electro house"
Tipper,1soJ22UMyjIw6SYFtoFJwe,43.0,"downtempo, glitch hop, nu skool breaks, psybass"
Dirty Projectors,5VF0YkVLeVD4ytyiyVSIiF,43.0,"art pop, brooklyn indie, experimental pop, indie pop, indie rock"
The Floozies,5czcqWtwZb5btfWWvWTmgZ,43.0,"jam band, lawrence ks indie"
Dan Deacon,5Z3IWpvwOvoaWodujHw7xh,43.0,"art pop, baltimore indie, indietronica"
Railroad Earth,6ijT84fUReKCGYV3MjhB2y,43.0,"bluegrass, jam band, jamgrass, new americana, progressive bluegrass, roots rock"
The Funk Hunters,5xwd7lKJeb2opUvYZnXFut,43.0,canadian electronic
Pigeons Playing Ping Pong,52NOvMXEjgf8MQl0qop2dl,43.0,jam band
The Infamous Stringdusters,7yTltkMBvChBkA86Tz8WfW,43.0,"bluegrass, instrumental bluegrass, jam band, jamgrass, mandolin, neo-traditional bluegrass, new americana, progressive bluegrass"
Wolf Parade,0XSqX2PB3C5dTMv7SZaxSm,42.0,"alternative rock, canadian indie, indie rock, modern rock, quebec indie, stomp and holler"
The Joy Formidable,4LdZNE5MHGqvc0N9ivXNF3,42.0,"indie rock, metropopolis, nu gaze, welsh indie, welsh rock"
Ghostland Observatory,2waNUwuthEgcBTFvYo26vo,42.0,"alternative dance, dance-punk, indietronica, new rave"
