artistName,artistID,artistPop,artistGenre
Steve Miller Band,6QtGlUje9TIkLrgPZrESuk,67.0,"album rock, blues rock, classic rock, country rock, folk rock, hard rock, heartland rock, mellow gold, psychedelic rock, rock, soft rock"
Kansas,2hl0xAkS2AIRAu23TVMBG1,67.0,"album rock, art rock, classic rock, hard rock, heartland rock, mellow gold, progressive rock, rock, soft rock, symphonic rock"
Waka Flocka Flame,6f4XkbvYlXMH0QgVRzW0sM,67.0,"atl hip hop, dirty south rap, gangster rap, pop rap, rap, southern hip hop, trap"
Billy Talent,08yf5A2nS4XEeNvabDXqyg,67.0,"canadian punk, punk"
Jungle,59oA5WbbQvomJz2BuRG071,67.0,"indie soul, uk contemporary r&b"
GoldLink,5XenQ7XfcvQdfIbpLEFaKQ,67.0,"dmv rap, hip hop, indie soul, r&b, rap, underground hip hop"
Death Cab For Cutie,0YrtvWJMgSdVrk3SfNjTbx,67.0,"indie pop, indie rock, modern rock, washington indie"
Boyz II Men,6O74knDqdv3XaWtkII7Xjp,67.0,"boy band, contemporary r&b, new jack swing, r&b, urban contemporary"
Claptone,4mncDFjVLUa3s025Tct3Ry,67.0,"deep disco house, german house, german techno, house, progressive house, tropical house"
Lloyd,1Xfmvd48oOhEWkscWyEbh9,67.0,"dance pop, hip pop, pop rap, r&b, southern hip hop, urban contemporary"
American Authors,0MlOPi3zIDMVrfA9R04Fe3,67.0,"indie poptimism, modern alternative rock, modern rock, pop rock"
Vampire Weekend,5BvJzeQpmsdsFp4HGUYUEx,67.0,"baroque pop, indie rock, modern rock, rock"
Stick Figure,5SXEylV07TC57eanSxxg4R,67.0,reggae fusion
Placebo,6RZUqkomCmb8zCRqc9eznB,67.0,"alternative rock, britpop, permanent wave, pop rock, rock"
Aphex Twin,6kBDZFXuLrZgHnvmPu9NsG,67.0,"ambient, braindance, electronica, intelligent dance music, uk experimental electronic"
Suki Waterhouse,5GGJosGMs08YEmKTZJe1fL,67.0,"indie pop, pop"
Arcade Fire,3kjuyTCjPG1WMFCiyc5IuB,67.0,"baroque pop, canadian indie, indie rock, modern rock, new rave, permanent wave, quebec indie, rock"
Portugal. the Man,4kI8Ie27vjvonwaB2ePh8T,67.0,"indie rock, modern alternative rock, modern rock, rock"
Pentatonix,26AHtbjWKiwYzsoGoUZq53,67.0,a cappella
Haim,4Ui2kfOqGujY81UcPrb5KE,67.0,"indie pop, metropopolis"
Phoenix,1xU878Z1QtBldR7ru9owdU,67.0,"alternative dance, indie rock, modern rock, new rave, rock independant francais"
Sg Lewis,0GG2cWaonE4JPrjcCCQ1EG,67.0,"edm, indie soul, new french touch, uk dance"
Earthgang,5MbNzCW3qokGyoo9giHA3V,67.0,"atl hip hop, hip hop, indie hip hop, psychedelic hip hop, rap, underground hip hop"
Asking Alexandria,1caBfBEapzw8z2Qz9q0OaQ,67.0,"alternative metal, metalcore, screamo, trancecore, uk metalcore"
Bonobo,0cmWgDlu9CwTgxPhf403hb,67.0,"downtempo, electronica, jazztronica, nu jazz, trip hop"
Leona Lewis,5lKZWd6HiSCLfnDGrq9RAm,67.0,"british soul, dance pop, europop, pop, post-teen pop, talent show"
Lupe Fiasco,01QTIT5P1pFP3QnnFSdsJf,67.0,"alternative hip hop, chicago rap, conscious hip hop, hip hop, political hip hop, pop rap, rap, southern hip hop"
Kenny Beats,1rHOtdmGNr5vcYNw5v7QGC,67.0,"trap, underground hip hop"
Motorhead,1DFr97A9HnbV3SKTJFu62M,67.0,"album rock, hard rock, metal, rock, speed metal"
Brad Paisley,13YmWQJFwgZrd4bf5IjMY4,67.0,"contemporary country, country, country road"
Danny Brown,7aA592KWirLsnfb5ulGWvU,67.0,"alternative hip hop, detroit hip hop, escape room, hip hop, rap, underground hip hop"
Olly Murs,3whuHq0yGx60atvA2RCVRW,67.0,"dance pop, pop, pop dance, post-teen pop, talent show, uk pop"
Snakehips,2FwJwEswyIUAljqgjNSHgP,67.0,"edm, electro house, electropop, indie poptimism, pop, pop dance, tropical house"
Fitz & The Tantrums,4AcHt3JxKy59IX7JNNlZn4,67.0,"indie poptimism, la indie, modern alternative rock, modern rock, pop rock, rock"
Dropkick Murphys,7w9jdhcgHNdiPeNPUoFSlx,67.0,"boston punk, boston rock, celtic punk, celtic rock, punk, skate punk"
Jake Owen,1n2pb9Tsfe4SwAjmUac6YT,67.0,"contemporary country, country, country road"
Unknown Mortal Orchestra,1LeVJ5GPeYDOVUjxx1y7Rp,66.0,"chillwave, indie rock, kiwi rock, neo-psychedelic, portland hip hop, psychedelic pop"
The Commodores,6twIAGnYuIT1pncMAsXnEm,66.0,"adult standards, disco, funk, mellow gold, motown, quiet storm, soft rock, soul"
Martin Solveig,1bj5GrcLom5gZFF5t949Xl,66.0,"dance pop, disco house, edm, electro house, filter house, house, pop dance, tropical house, vocal house"
The Wombats,0Ya43ZKWHTKkAbkoJJkwIB,66.0,"liverpool indie, modern rock, rock"
The Prodigy,4k1ELeJKT1ISyDv8JivPpB,66.0,"big beat, breakbeat, dance rock, hardcore techno, rave"
Boy Pablo,7wbkl3zgDZEoZer357mVIw,66.0,"bedroom pop, bergen indie, norwegian indie"
GZA,6ns6XAOsw4B0nDUIovAOUO,66.0,"alternative hip hop, east coast hip hop, gangster rap, hardcore hip hop, hip hop, rap"
Theory of a Deadman,74eX4C98E4FCrAMl39qRsJ,66.0,"alternative metal, canadian metal, canadian rock, nu metal, post-grunge, rap rock"
Interpol,3WaJSfKnzc65VDgmj2zU8B,66.0,"alternative rock, indie rock, modern rock, rock"
Gojira,0GDGKpJFhVpcjIGF8N6Ewt,66.0,"alternative metal, french death metal, french metal, metal, nu metal, progressive groove metal"
Daughtry,5P5FTygHyx2G57oszR3Wot,66.0,"alternative metal, neo mellow, pop rock, post-grunge"
Dave Matthews Band,2TI7qyDE0QfyOlnbtfDo7L,66.0,"jam band, neo mellow, pop rock"
Craig David,2JyWXPbkqI5ZJa3gwqVa0c,66.0,"british soul, dance pop, pop rap, r&b, urban contemporary"
London Grammar,3Bd1cgCjtCI32PYvDC3ynO,66.0,"metropopolis, nottingham indie"
Eric Prydz,5sm0jQ1mq0dusiLtDJ2b4R,66.0,"disco house, edm, electro house, house, pop dance, progressive house, vocal house"
Matt Maeson,7gHscNMDI8FF8pcgrV8eIn,66.0,modern rock
Modest Mouse,1yAwtBaoHLEDWAnWR87hBT,66.0,"alternative rock, double drumming, indie rock, modern rock, rock, washington indie"
AME,7htQnykNfk2Bu39bSw7owz,66.0,
First Aid Kit,21egYD1eInY6bGFcniCRT1,66.0,"stomp and holler, swedish americana, swedish country"
Duke Dumont,61lyPtntblHJvA7FMMhi7E,66.0,"dance pop, destroy techno, edm, electro house, house, pop dance, progressive house, tropical house"
Rina Sawayama,2KEqzdPS7M5YwGmiuPTdr5,66.0,"art pop, dance pop, electropop, escape room, pop"
Dvbbs,5X4LWwbUFNzPkEas04uU82,66.0,"canadian electronic, dance pop, edm, electro house, pop, pop dance, pop edm, progressive electro house, slap house, tropical house"
Lifehouse,5PokPZn11xzZXyXSfnvIM3,66.0,"alternative metal, neo mellow, pop rock, post-grunge"
Kyle,4qBgvVog0wzW75IQ48mU7v,66.0,"pop, pop rap, rap, viral rap"
Fleet Foxes,4EVpmkEwrLYEg6jIsiPMIb,66.0,"chamber pop, folk, indie folk, indie pop, indie rock, seattle indie, stomp and holler"
The Drums,0p5axeJsbtTCXBrRVoKjwu,66.0,"brooklyn indie, indie rock, indie surf, modern rock"
The Animals,3ICflSq6ZgYAIrm2CTkfVP,66.0,"album rock, blues rock, british invasion, classic rock, folk rock, protopunk, psychedelic rock, rock"
José González,6xrCU6zdcSTsG2hLrojpmI,66.0,"gothenburg indie, indie folk, neo mellow, stomp and holler, swedish indie folk, swedish indie pop, swedish singer-songwriter"
Emeli Sandé,7sfgqEdoeBTjd8lQsPT3Cy,66.0,"dance pop, neo soul, pop, r&b, uk pop"
Little Big Town,3CygdxquGHurS7f9LjNLkv,66.0,"contemporary country, country, country dawn, country road"
Massive Attack,6FXMGgJwohJLUSr5nVlf9X,66.0,"big beat, downtempo, electronica, trip hop"
ZHU,28j8lBWDdDSHSSt5oPlsX2,66.0,"edm, electro house"
Sleeping With Sirens,3N8Hy6xQnQv1F1XCiyGQqA,66.0,"metalcore, modern rock, pop emo, pop punk, screamo"
Axwell,2XnBwblw31dfGnspMIwgWz,66.0,"dance pop, edm, electro house, pop, pop dance, tropical house"
Foals,6FQqZYVfTNQ1pCqfkwVFEa,66.0,"alternative dance, indie rock, modern rock, new rave, oxford indie, rock"
Vicetone,0daugAjUgbJSqdlyYNwIbT,66.0,"edm, electro house, gaming edm, pop dance, pop edm, progressive electro house, tropical house"
CHVRCHES,3CjlHNtplJyTf9npxaPl5w,66.0,"electropop, metropopolis, neo-synthpop, shimmer pop"
King Gizzard and the Lizard Wizard,6XYvaoDGE0VmRt83Jss9Sn,66.0,"australian indie, australian psych, double drumming, microtonal, neo-psychedelic"
Lindsey Stirling,378dH6EszOLFShpRzAQkVM,66.0,"bow pop, pop violin"
Whitesnake,3UbyYnvNIT5DFXU4WgiGpP,66.0,"album rock, british blues, classic rock, glam metal, hard rock, metal, rock"
Josh Turner,7vCtweS8UVAXTyau2j0rDT,66.0,"contemporary country, country, country road"
Michael Kiwanuka,0bzfPKdbXL5ezYW2z3UGQj,66.0,"british soul, neo soul, psychedelic soul, soul"
Remi Wolf,0NB5HROxc8dDBXpkIi1v3d,66.0,"indie pop, indie r&b, modern alternative pop, pop"
Azealia Banks,7gRhy3MIPHQo5CXYfWaw9I,66.0,"alternative r&b, dance pop, escape room, hip house, lgbtq+ hip hop, pop, trap queen"
Peach Pit,6fC2AcsQtd9h4BWELbbire,66.0,"indie pop, indie rock, modern rock, vancouver indie"
Axwell & Ingrosso,2XnBwblw31dfGnspMIwgWz,66.0,"dance pop, edm, electro house, pop, pop dance, tropical house"
REO Speedwagon,55vs7NT1KxcFjbMC4y202E,66.0,"album rock, classic rock, hard rock, heartland rock, mellow gold, rock, soft rock"
Slightly Stoopid,6MxlVTY6PmY8Nyn16fvxtb,65.0,"reggae fusion, reggae rock"
The Blessed Madonna,4TvhRzxIL1le2PWCeUqxQw,65.0,
The Head and the Heart,0n94vC3S9c3mb2HyNAOcjg,65.0,"folk-pop, indie folk, seattle indie, stomp and holler"
Royal Blood,2S5hlvw4CMtMGswFtfdK15,65.0,"alternative rock, brighton indie, garage rock, modern alternative rock, modern blues rock, modern hard rock, modern rock, rock"
Stone Sour,49qiE8dj4JuNdpYGRPdKbF,65.0,"alternative metal, nu metal, post-grunge, rap rock, rock"
Ray LaMontagne,6DoH7ywD5BcQvjloe9OcIj,65.0,"acoustic pop, indie folk, neo mellow, new americana, stomp and holler"
Grouplove,3kVUvbeRdcrqQ3oHk5hPdx,65.0,"indie pop, indie poptimism, indie rock, indietronica, la indie, modern alternative rock, modern rock, rock, stomp and holler"
Chaka Khan,6mQfAAqZGBzIfrmlZCeaYT,65.0,"dance pop, disco, funk, neo soul, post-disco, quiet storm, soul, urban contemporary"
Corinne Bailey Rae,29WzbAQtDnBJF09es0uddn,65.0,"british soul, neo mellow, neo soul, pop soul, soul"
Blackstreet,2P3cjUru4H3fhSXXNxE9kA,65.0,"boy band, contemporary r&b, dance pop, hip hop, hip pop, neo soul, new jack swing, pop rap, quiet storm, r&b, urban contemporary"
Parkway Drive,159qqlGwzE04xyqpfAwRLo,65.0,"australian metalcore, melodic metalcore, metalcore"
Alice Cooper,3EhbVgyfGd7HkpsagwL9GS,65.0,"album rock, blues rock, classic rock, detroit rock, glam metal, glam rock, hard rock, metal, protopunk, rock"
Gorgon City,4VNQWV2y1E97Eqo2D5UTjx,65.0,"deep groove house, edm, future garage, house, pop dance, progressive house, tropical house, uk dance"
Stereophonics,21UJ7PRWb3Etgsu99f8yo8,65.0,"britpop, modern rock, neo mellow, pop rock, rock, welsh rock"
FKA Twigs,6nB0iY1cjSY1KyhYyuIIKH,65.0,"afrofuturism, alternative r&b, art pop, escape room, experimental r&b, pop, trip hop"
Father John Misty,2kGBy2WHvF0VdZyqiVCkDT,65.0,"chamber pop, indie pop, indie rock"
Three 6 Mafia,26s8LSolLfCIY88ysQbIuT,65.0,"crunk, dirty south rap, gangster rap, hip hop, memphis hip hop, pop rap, rap, southern hip hop, tennessee hip hop, trap"
James Morrison,3LpLGlgRS1IKPPwElnpW35,65.0,"dance pop, neo mellow, neo soul, pop, pop rock"
Mura Masa,5Q81rlcTFh3k6DQJXPdsot,65.0,"channel islands indie, hyperpop, vapor soul"
Poison,1fBCIkoPOPCDLUxGuWNvyo,65.0,"album rock, glam metal, hard rock, rock"
Chevelle,56dO9zeHKuU5Gvfc2kxHNw,65.0,"alternative metal, alternative rock, christian rock, nu metal, post-grunge, rap rock, rock"
Cedric Gervais,4Wjf8diP59VmPG7fi4y724,65.0,"edm, electro house, house"
Catfish and the Bottlemen,2xaAOVImG2O6lURwqperlD,65.0,"modern alternative rock, modern rock, rock, stomp pop, welsh rock"
Cash Cash,1LOB7jTeEV14pHai6EXSzF,65.0,"dance pop, edm, electro house, electropop, electropowerpop, pop, pop dance, pop edm, tropical house"
Wet Leg,2TwOrUcYnAlIiKmVQkkoSZ,65.0,"crank wave, indie rock"
Chase Rice,6pBNfggcZZDCmb0p92OnGn,65.0,"contemporary country, country, country road, modern country rock"
Brothers Osborne,39NR3AUhpbbqKM33vWn2fp,65.0,"contemporary country, country, country road, modern southern rock"
Halestorm,6om12Ev5ppgoMy3OYSoech,65.0,"alternative metal, nu metal, post-grunge"
Blasterjaxx,37awA8DFCAnCCL7aqYbDnD,65.0,"big room, dutch house, edm, electro house, pop dance, slap house"
Iggy Pop,33EUXrFKGjpUSGacqEHhU4,65.0,"classic rock, glam rock, permanent wave, protopunk, punk, rock"
Mike Candys,24Sxfn1uAoJmuR9N72drt9,65.0,"edm, pop dance, pop house"
Action Bronson,7BMccF0hQFBpP6417k1OtQ,65.0,"alternative hip hop, east coast hip hop, escape room, hip hop, nyc rap, queens hip hop, rap, underground hip hop"
Nicky Romero,5ChF3i92IPZHduM7jN3dpg,65.0,"big room, dance pop, dutch edm, edm, electro house, pop dance, pop edm, progressive electro house, progressive house, tropical house"
Vini Vici,29zsVzEH33dD5QqxeL8dvy,65.0,progressive uplifting trance
Parcels,3oKRxpszQKUjjaHz388fVA,65.0,"aussietronica, indie soul"
CeeLo Green,5nLYd9ST4Cnwy6NHaCxbj8,65.0,atl hip hop
Parcels,3oKRxpszQKUjjaHz388fVA,65.0,"aussietronica, indie soul"
Yellow Claw,47z7ZrgFoBvVpCnElCE3Zh,65.0,"bass trap, edm, electro house, electronic trap, pop dance"
Kelis,0IF46mUS8NXjgHabxk2MCM,65.0,"dance pop, electropop, hip pop, neo soul, r&b, urban contemporary"
Low,7FW2qwsY0zLV9GppWatQ5P,65.0,
311,41Q0HrwWBtuUkJc7C1Rp6K,65.0,"alternative metal, alternative rock, funk metal, funk rock, nu metal, pop rock, rap rock, reggae fusion, rock"
Porter Robinson,3dz0NnIZhtKKeXZxLOxCam,65.0,"complextro, edm, future bass, pop dance, progressive electro house"
Killswitch Engage,37394IP6uhnjIpsawpMu4l,65.0,"alternative metal, boston metal, melodic metalcore, metalcore, nu metal"
Third Eye Blind,6TcnmlCSxihzWOQJ8k0rNS,65.0,"alternative rock, neo mellow, pop rock, post-grunge, rock"
Four Tet,7Eu1txygG6nJttLHbZdQOh,65.0,"electronica, folktronica, intelligent dance music"
Rebelution,2WjvvwAX0mdWwq3aFuUdtc,64.0,reggae rock
St. Vincent,7bcbShaqKdcyjnmv4Ix8j6,64.0,"art pop, chamber psych, electropop, etherpop, indie pop, indie rock, metropopolis"
Yves Tumor,0qu422H5MOoQxGjd4IzHbS,64.0,"alternative r&b, art pop, escape room, experimental r&b"
Doechii,4E2rKHVDssGJm2SCDOMMJB,64.0,"alternative r&b, escape room, pop, r&b, rap, viral rap"
Ethel Cain,0avMDS4HyoCEP6RqZJWpY2,64.0,"art pop, indie pop, modern dream pop, pop"
Hippo Campus,1btWGBz4Uu1HozTwb2Lm8A,64.0,"indie pop, indie poptimism, indie rock, minneapolis indie, modern alternative rock, modern rock"
Boris Brejcha,6caPJFLv1wesmM7gwK1ACy,64.0,"german house, german techno, high-tech minimal, minimal techno, tech house"
Kip Moore,2hJPr4lk7Q8SSvCVBl9fWM,64.0,"contemporary country, country, country road, modern country rock"
Black Veil Brides,6O7MpKrY91vlCd4Osi6XKs,64.0,"alternative metal, modern rock, screamo"
Subtronics,3NJ94iuAmmMjbszODYT6pO,64.0,"dubstep, edm, electro house"
Beartooth,6vwjIs0tbIiseJMR3pqwiL,64.0,"metalcore, modern rock"
Awolnation,4njdEjTnLfcGImKZu1iSrz,64.0,"la indie, modern alternative rock, modern rock, rock, stomp pop"
Thievery Corporation,25KNo5GDS6ZpLkjasaecA3,64.0,"downtempo, electronica, livetronica, nu jazz, trip hop"
Tash Sultana,6zVFRTB0Y1whWyH7ZNmywf,64.0,australian reggae fusion
Louis The Child,7wg1qvie3KqDNQbAkTdbX0,64.0,"edm, electro house, electronic trap, electropop, indie poptimism, pop, pop dance, tropical house, vapor twitch"
Styx,4salDzkGmfycRqNUbyBphh,64.0,"album rock, art rock, classic rock, hard rock, mellow gold, progressive rock, rock, soft rock, symphonic rock"
Toro Y Moi,6O4EGCCb6DoIiR6B1QCQgp,64.0,"alternative dance, chillwave, electronica, indie soul, indietronica, new rave"
Zeds Dead,67qogtRNI0GjUr8PlaG6Zh,64.0,"brostep, canadian electronic, dubstep, edm, electro house, electronic trap, progressive electro house, vapor twitch"
Sarah McLachlan,4NgNsOXSwIzXlUIJcpnNUp,64.0,"canadian pop, canadian singer-songwriter, ectofolk, lilith, permanent wave, pop rock"
Baby Bash,12PSlydMSjEHzSCj9X5qv7,64.0,"chicano rap, dance pop, dirty south rap, gangster rap, hip hop, hip pop, latin hip hop, pop rap, r&b, rap, southern hip hop, texas latin rap, urban contemporary"
The Isley Brothers,53QzNeFpzAaXYnrDBbDrIp,64.0,"classic soul, disco, funk, motown, quiet storm, soul"
The Chemical Brothers,1GhPHrq36VKCY3ucVaZCfo,64.0,"alternative dance, big beat, breakbeat, electronica, new rave, rave"
Chemical Brothers,1GhPHrq36VKCY3ucVaZCfo,64.0,"alternative dance, big beat, breakbeat, electronica, new rave, rave"
Kasabian,11wRdbnoYqRddKBrpHt4Ue,64.0,"alternative rock, britpop, garage rock, indie rock, leicester indie, modern rock, rock"
The Used,55VydwMyCuGcavwPuhutPL,64.0,"post-hardcore, screamo"
The Red Jumpsuit Apparatus,1SImpQO0GbjRgvlwCcCtFo,64.0,"pop punk, pop rock, screamo"
The Shins,4LG4Bs1Gadht7TCrMytQUO,64.0,"albuquerque indie, alternative rock, indie pop, indie rock, modern rock, portland indie, stomp and holler"
Gavin DeGraw,5DYAABs8rkY9VhwtENoQCz,64.0,"neo mellow, pop rock"
AFI,19I4tYiChJoxEO5EuviXpz,64.0,"alternative metal, pop punk, punk, screamo, skate punk"
Puddle of Mudd,3dXaa6jwM7B52GZpaJEIr5,64.0,"alternative metal, alternative rock, modern rock, nu metal, post-grunge, rap rock, rock"
Adam Lambert,6prmLEyn4LfHlD9NnXWlf7,64.0,"dance pop, idol, pop, post-teen pop"
Skid Row,4opTS86dN9uO313J9CE8xg,64.0,"album rock, glam metal, hard rock, metal, rock"
Trivium,278ZYwGhdK6QTzE3MFePnP,64.0,"alternative metal, melodic metalcore, melodic thrash, metal, metalcore, nu metal"
Iron & Wine,4M5nCE77Qaxayuhp3fVn4V,64.0,"acoustic pop, chamber pop, indie folk, indie pop, neo mellow, stomp and holler"
Future Islands,1WvvwcQx0tj6NdDhZZ2zZz,64.0,"alternative dance, baltimore indie, chillwave, indie rock, indietronica, modern rock, new rave"
AlunaGeorge,2VAnyOxzJuSAj7XIuEOT38,64.0,"electropop, house, tropical house"
Cake,6A43Djmhbe9100UwnI7epV,64.0,"alternative rock, modern rock, pop rock, rock, sacramento indie"
Die Toten Hosen,2F8GvYuY0lfZNYu45dY6gJ,64.0,"german alternative rock, german pop, german punk, german rock"
Dr. Dog,4mLJ3XfOM5FPjSAWdQ2Jk7,64.0,"indie folk, indie rock, modern folk rock, modern rock, philly indie, stomp and holler"
Edward Sharpe & The Magnetic Zeros,7giUHu5pv6YTZgSkxxCcgh,64.0,"double drumming, indie folk, la indie, stomp and holler"
Paul Kalkbrenner,0rasA5Z5h1ITtHelCpfu9R,64.0,"electronica, german techno, leipzig electronic, minimal techno, tech house"
Blood Orange,6LEeAFiJF8OuPx747e1wxR,64.0,"alternative r&b, art pop, chillwave, metropopolis"
Bleachers,2eam0iDomRHGBypaDQLwWI,64.0,"double drumming, indie pop, indie poptimism, modern rock, pop, pop rock"
Fatboy Slim,4Y7tXHSEejGu1vQ9bwDdXW,64.0,big beat
Björk,7w29UYBi0qsHi5RTcv3lmA,64.0,"art pop, experimental pop, experimental vocal, icelandic experimental, icelandic pop, icelandic singer-songwriter, metropopolis, permanent wave"
Parov Stelar,65EXuYHVoehCKqp0kOS6px,64.0,"balkan beats, downtempo, electro swing, nu jazz, tropical house"
Chet Faker,6UcJxoeHWWWyT5HZP064om,64.0,"art pop, indietronica"
Showtek,3gk0OYeLFWYupGFRHqLSR7,64.0,"classic hardstyle, edm, electro house, euphoric hardstyle, pop dance, progressive electro house"
Nick Cave And The Bad Seeds,4UXJsSlnKd7ltsrHebV79Q,64.0,"art rock, permanent wave"
Bad Religion,2yJwXpWAQOOl5XFzbCxLs9,64.0,"punk, skate punk, socal pop punk"
Nick Cave & The Bad Seeds,4UXJsSlnKd7ltsrHebV79Q,64.0,"art rock, permanent wave"
Bicep,73A3bLnfnz5BoQjb4gNCga,64.0,"ambient house, electronica, house"
Metronomy,54QMjE4toDfiCryzYWCpXX,64.0,"alternative dance, electronica, french indie pop, indie rock, indietronica, modern rock, new rave, socal pop punk"
Tenacious D,1XpDYCrUJnvCo9Ez6yeMWh,63.0,"alternative metal, comedy rock, comic, comic metal, parody, rock"
Cheap Trick,1LB8qB5BPb3MHQrfkvifXU,63.0,"album rock, art rock, beatlesque, classic rock, glam metal, glam rock, hard rock, heartland rock, mellow gold, new wave pop, pop rock, power pop, rock, soft rock"
The Last Shadow Puppets,2Z7UcsdweVlRbAk5wH5fsf,63.0,"baroque pop, indie rock, modern rock, rock, sheffield indie"
Bush,78SHxLdtysAXgywQ4vE0Oa,63.0,"alternative metal, alternative rock, grunge, nu metal, pop rock, post-grunge, rock"
Rezz,4aKdmOXdUKX07HVd3sGgzw,63.0,"canadian electronic, edm, electra, electro house"
The Avett Brothers,196lKsA13K3keVXMDFK66q,63.0,"indie folk, new americana, north carolina indie, north carolina roots, progressive bluegrass, stomp and holler"
Ben Harper,45lorWzrKLxfKlWpV7r9CN,63.0,"neo mellow, pastoral"
Big Wild,0PxzGnCYBpSuaI49OR94cA,63.0,"indie poptimism, vapor twitch"
Midland,1DTZRmlVZBxx2wRQBtx6yi,63.0,"neo-traditional country, texas country"
Turnstile,2qnpHrOzdmOo1S4ox3j17x,63.0,"hardcore punk, modern melodic hardcore"
Quintino,1V3VTM7VspiQjcmRhC010n,63.0,"dutch edm, dutch house, edm, electro house, pop dance, progressive electro house, progressive house, slap house"
The Black Crowes,5krkohEVJYw0qoB5VWwxaC,63.0,"album rock, blues rock, classic rock, country rock, hard rock, jam band, pop rock, rock, southern rock"
Escape the Fate,5ojhEavq6altxW8fWIlLum,63.0,"alternative metal, metalcore, pixie, pop punk, screamo"
Chase & Status,3jNkaOXasoc7RsxdchvEVq,63.0,"dancefloor dnb, drum and bass"
Bowling for Soup,5ND0mGcL9SKSjWIjPd0xIb,63.0,"comic, pop punk, texas pop punk"
Little Dragon,6Tyzp9KzpiZ04DABQoedps,63.0,"alternative dance, alternative r&b, art pop, chillwave, downtempo, electronica, electropop, escape room, gothenburg indie, indie soul, indietronica, new rave, swedish electropop, swedish synthpop, trip hop"
The Human League,1aX2dmV8XoHYCOQRxjPESG,63.0,"art rock, new romantic, new wave, new wave pop, permanent wave, rock, soft rock, sophisti-pop, synthpop"
Neil Young,6v8FB84lnmJs434UJf2Mrm,63.0,"canadian singer-songwriter, classic canadian rock, classic rock, mellow gold, permanent wave, rock, roots rock, singer-songwriter"
Jessie Ware,5Mq7iqCWBzofK39FBqblNc,63.0,"art pop, british soul, dance pop, electropop, neo soul, pop, pop soul, tropical house"
Wolfmother,3yEnArbNHyTCwMRvD9SBy4,63.0,"alternative rock, australian psych, garage rock, modern alternative rock, modern blues rock, modern rock, rock"
Regina Spektor,3z6Gk257P9jNcZbBXJNX5i,63.0,"indie pop, lilith, piano rock"
NoFx,4S2yOnmsWW97dT87yVoaSZ,63.0,"punk, skate punk, socal pop punk"
Feist,6CWTBjOJK75cTE8Xv8u1kj,63.0,"canadian indie, canadian pop, chamber pop, indie pop"
Princess Nokia,6lay1nwbE6hTx1jivysUAL,63.0,"alternative r&b, escape room, lgbtq+ hip hop, pop, trap queen, viral rap"
Faithless,5T4UKHhr4HGIC0VzdZQtAE,63.0,"big beat, downtempo, electronica, trip hop"
Faith No More,6GbCJZrI318Ybm8mY36Of5,63.0,"alternative metal, alternative rock, funk metal, funk rock, hard rock, nu metal, rap metal, rap rock, rock"
Excision,5FKchcZpQOkqFvXBj1aCvb,63.0,"brostep, canadian electronic, edm, electro house, electronic trap"
Twisted Sister,7b85ve82Sh36a3UAx74wut,63.0,"album rock, glam metal, hard rock, metal, rock"
Atreyu,3LkSiHbjqOHCKCqBfEZOTv,63.0,"alternative metal, melodic metalcore, metalcore, nu metal, rap rock, screamo"
Taking Back Sunday,24XtlMhEMNdi822vi0MhY1,63.0,"emo, pop punk"
Portishead,6liAMWkVf5LH7YR9yfFy1Y,63.0,"dark pop, electronica, laboratorio, trip hop"
Royksopp,5nPOO9iTcrs9k6yFffPxjH,63.0,"alternative dance, downtempo, electronica, electropop, trip hop"
Common,2GHclqNVjqGuiE5mA7BEoc,63.0,"alternative hip hop, chicago rap, conscious hip hop, gangster rap, hip hop, neo soul, political hip hop, rap"
A-Trak,3TaUSUXn41GixL7zbvrIDt,63.0,"canadian electronic, disco house, edm, electro house, house, turntablism"
The Band Camino,6d4jrmreCmsenscuieJERc,63.0,"hopebeat, indie poptimism, neo mellow, pop, pop rock"
Amon Amarth,3pulcT2wt7FEG10lQlqDJL,63.0,"alternative metal, death metal, melodic death metal, metal, power metal, swedish death metal, swedish melodeath, swedish metal, tolkien metal, viking metal"
Above & Beyond,10gzBoINW3cLJfZUka8Zoe,63.0,"edm, pop dance, progressive house, progressive trance, trance, uplifting trance"
Solange,2auiVi8sUZo17dLy1HwrTU,63.0,"afrofuturism, alternative r&b, dance pop, escape room, hip pop, indie soul, neo soul, r&b, urban contemporary"
Airbourne,6urzdpGY5yUimWZsgJUoTb,63.0,"glam metal, hard rock, metal, rock"
Anderson .Paak and The Free Nationals,4596e2d3KmYzAeVenjCxfj,63.0,"alternative r&b, indie soul"
Sub Zero Project,4f0OXMMSxr0r8Ztx6CdpAl,63.0,"euphoric hardstyle, rawstyle"
Vulfpeck,7pXu47GoqSYRajmBCjxdD6,63.0,"ann arbor indie, funk rock, instrumental funk"
Joy Crookes,5XMyhVhi5ZN2pi0Qwi1zXS,63.0,"alternative r&b, indie r&b, indie soul, uk contemporary r&b"
Nora En Pure,24DO0PijjITGIEWsO8XaPs,63.0,"deep house, edm, electra, house, progressive house, swiss pop, tropical house"
Sharon Jones and the Dap Kings,6LufpoVlIYKQCu9Gjpk8B7,63.0,"black americana, classic soul, funk, neo soul, retro soul, soul, southern soul"
Car Seat Headrest,5PbpKlxQE0Ktl5lcNABoFf,62.0,"alternative rock, indie pop, indie rock, rock"
In This Moment,6tbLPxj1uQ6vsRQZI2YFCT,62.0,"alternative metal, nu metal, slayer"
Cat Dealers,3q2dSq7VZnj8TmoJUyRm40,62.0,brazilian edm
Cold War Kids,6VDdCwrBM4qQaGxoAyxyJC,62.0,"alternative rock, garage rock, indie rock, modern alternative rock, modern rock, piano rock, rock, stomp and holler"
David Gray,7J2lZBANizgPNfUzux31PV,62.0,"acoustic pop, neo mellow, permanent wave, pop rock"
The Roots,78xUyw6FkVZrRAtziFdtdu,62.0,"alternative hip hop, conscious hip hop, east coast hip hop, hardcore hip hop, hip hop, philly rap, political hip hop, southern hip hop"
Nathaniel Rateliff,02seUFsFQP7TH4hLrTj77o,62.0,"new americana, rock, stomp and holler"
Jack U,1HxJeLhIuegM3KgvPn8sTa,62.0,"dance pop, edm, electro house, pop dance"
Coheed and Cambria,3utxjLheHaVEd9bPjQRsy8,62.0,"alternative metal, emo, screamo"
The War on Drugs,6g0mn3tzAds6aVeUYRsryU,62.0,"indie rock, philly indie"
The Pretty Reckless,2R57sY41L9XvGPiIgHOaYq,62.0,"alternative metal, candy pop"
Hinder,6BMhCQJYHxxKAeqYS1p5rY,62.0,"alternative metal, nu metal, pop rock, post-grunge"
Mayday Parade,3WfJ1OtrWI7RViX9DMyEGy,62.0,"neon pop punk, pop emo, pop punk, rock"
Yes,7AC976RDJzL2asmZuz7qil,62.0,"album rock, art rock, classic rock, jazz fusion, progressive rock, rock, symphonic rock"
Bloc Party,3MM8mtgFzaEJsqbjZBSsHJ,62.0,"alternative dance, dance-punk, indie rock, modern rock, new rave, rock"
The Fratellis,3M4ThdJR28z9eSMcQHAZ5G,62.0,"alternative rock, garage rock, modern rock, rock, scottish rock"
Wolf Alice,3btzEQD6sugImIHPMRgkwV,62.0,"indie pop, indie rock, modern alternative rock, modern rock, rock"
